ISIN,Company Name,Company Address,Company City,Company State,Company PIN,Company Telephone,Company Fax,Company Email,Company Website,Registrar Name,Registrar Address,Registrar City,Registrar PIN,Registrar State,Registrar Telephone,Registrar Fax,Registrar Email,Registrar Website
INE386C01029,Astra Microwave Products Ltd.,"ASTRA Towers, Survey No.12 (P),,Kothaguda Post, Kondapur,",Hyderabad,Telangana,500084,040-30618000 040-30618001,040-30618048 040-30618007,info@astramwp.com,http://www.astramwp.com,Purva Sharegistry (india) Pvt. Ltd.,"Unit No.9, Ground Floor, Shiv Shakti Industrial Estate, J R Boricha Marg, Opp. Kasturba Hospital Lane, Lower Parel",Mumbai,400011,Maharashtra,"022-23016761, 23018261",022-23012517,busicomp@vsnl.com,http://www.purvashare.com
INE463A01038,Berger Paints India Ltd.,"Berger House, 129, Park Street,,",Kolkata,West Bengal,700017,033-22299724-28 ,033-22277288 033-2249 9009,consumerfeedback@bergerindia.com,http://www.bergerpaints.com,C B Management Services (P) Ltd.,"P-22, 2nd Floor, Bondel Road  ",Kolkata,700019,West Bengal,"033-40116700, 22806692, 22806693, 22806694, 228024",033-22870263,rta@cbmsl.com,http://www.cbmsl.com
INE757A01017,Cosmo Films Ltd.,"1008, DLF Tower-A, Jasola District Centre,",New Delhi,Delhi,110025,011-49494949 ,011-49494950 ,investor.relations@cosmofilms.com,http://www.cosmofilms.com,Alankit Assignment Ltd.,"1E/13, Alankit Heights,
Jhandewalan Extension   ",New Delhi,110055,Delhi,"011-42541234, 42541960",011-23552001,rta@alankit.com,http://www.alankit.com
INE451A01017,Force Motors Ltd.,"Mumbai-Pune Road, Akurdi,,",Pune,Maharashtra,411035,020-27476381 ,020-27473017 ,compliance-officer@forcemotors.com,http://www.forcemotors.com,Link Intime India Pvt. Ltd.,"Block 202, 2nd Floor, Akshya Complex, Off Dhole Patil Road ",Pune,411001,Maharashtra,"020-26051629, 26050084",020-26053503,pune@linkintime.co.in,http://www.linkintime.co.in
INE152B01027,Gati Ltd.,"Plot No. 20, Survey No. 12,,Kothaguda,",Hyderabad,Telangana,500084,040-71204284 ,040-23112318 ,investor.services@gati.com,http://www.gati.com,Karvy Computershare Private Ltd.,"Karvy Selenium Tower B, 
Plot No. 31-32, Gachibowl   ",Hyderabad,500032,Telangana,"040-67162222, 67161500","040-23420814, 23001153",einward.ris@karvy.com,http://www.karvycomputershare.com
