topic,url,votes
Happy Valentine's Day from me and my Valentine.,https://i.redd.it/dhb9nsytp3g01.jpg,510,india
its her 85th birthday today,https://pbs.twimg.com/media/DV92zyJWsAAC8c5.jpg,353,india
While the rest of the country is being terrorized by the Bajrang Dal... [x-post r/Kerala],https://i.imgur.com/tnEyERJ.jpg,246,india
"Being afraid to check your bank account is the adult version of being afraid to check your grades, while as a college student you are afraid to check both.",https://www.reddit.com/r/Showerthoughts/comments/7xgyjl/being_afraid_to_check_your_bank_account_is_the/,25.4k,Showerthoughts
Valentine Day Special !,https://i.redd.it/ry0f8k17l4g01.jpg,198,india
India rise to No. 1 in ODI rankings,http://www.espncricinfo.com/story/_/id/22428133/india-rise-no.-1-odi-rankings,207,Cricket
"Sitting In Car, BJP Lawmaker Watches His Son Beat Up Toll Booth Worker",https://www.ndtv.com/india-news/sitting-in-car-bjp-lawmaker-pooran-prakash-watches-his-son-beat-up-toll-booth-worker-in-mathura-1812495,107,india
Ahoy matey! Does this be arrrrr/evilbuildings?,https://i.imgur.com/lP9z0zn.jpg,4198,evilbuildings
Honor India is Running Negative Twitter Campaign Against Xiaomi's Redmi Note 5 Launch! [Investigation with Proofs Attached],https://onphones.com/dear-honor-india-stop-cheap-marketing-tactics/1979/amp/,202,Android
Textiles in Shimla,https://i.redd.it/5h5bs7anl3g01.jpg,208,india
This is the first time in 20 years I didn’t get a Valentines Day Card from my secret admirer.,https://www.reddit.com/r/Jokes/comments/7xh6me/this_is_the_first_time_in_20_years_i_didnt_get_a/,783,Jokes
WhatsApp University presents ‘Did u know?’,https://i.redd.it/qybagcedk4g01.jpg,99,india
Xiaomi Redmi Note 5 Pro preview: Possibly the best budget phone of 2018,https://www.androidcentral.com/xiaomi-redmi-note-5-pro,260,Android
Mi TV 4 launched in India at price of 39999,https://i.redd.it/g1qt9ldry4g01.jpg,72,india
From an abusive ex,https://www.reddit.com/r/niceguys/comments/7xgkmt/from_an_abusive_ex/,11.1k,niceguys
Why spread hate ?,https://i.imgur.com/igPUn4F.jpg,212,india
My school's swedish textbook has PewDiePie in it,https://www.reddit.com/r/PewdiepieSubmissions/comments/7xgdse/my_schools_swedish_textbook_has_pewdiepie_in_it/,816,PewdiepieSubmissions
#BREAKING - A complaint has been filed against the viral song featuring Priya Prakash Varrier for hurting Muslim sentiments at Falaknama Police station. The complaint says nothing against the actress.,https://twitter.com/CNNnews18/status/963632687482392577,97,india
"Contrast | Bandra Bandstand, Mumbai 2018",https://i.imgur.com/Mi6301U.jpg,145,india
India's current ODI run. Incredible !,https://www.reddit.com/r/Cricket/comments/7xfolb/indias_current_odi_run_incredible/,125,Cricket
Me on valentine's day,https://www.reddit.com/r/PewdiepieSubmissions/comments/7xfbdf/me_on_valentines_day/,1950,PewdiepieSubmissions
"""See Mom, I told you there was a red dot""",https://i.imgur.com/03XsYId.gifv,21.2k,Eyebleach
Bich got rekt,https://www.reddit.com/r/PewdiepieSubmissions/comments/7xgoh9/bich_got_rekt/,566,PewdiepieSubmissions
Opinion on Achhe Din has reversed in last eight months: Latest CSDS survey,https://imgur.com/a/wWB08,134,india
To become a dominant movie streaming service,https://www.reddit.com/r/therewasanattempt/comments/7xf90c/to_become_a_dominant_movie_streaming_service/,24.0k,therewasanattempt
How to beat snake.,https://i.imgur.com/c91j0hJ.gifv,23.1k,gaming
Donald Trump slams India for high import tariffs on Harley-Davidson,http://www.thehindu.com/news/international/donald-trump-slams-india-for-high-import-tariffs-on-harley-davidson/article22748151.ece?homepage=true,107,india
A single Scot's motto on Valentine's,https://www.reddit.com/r/ScottishPeopleTwitter/comments/7xgjfe/a_single_scots_motto_on_valentines/,3513,ScottishPeopleTwitter
PEWDIEPIE RETURNING 📰Pew News📰,https://www.reddit.com/r/PewdiepieSubmissions/comments/7xgsnf/pewdiepie_returning_pew_news/,197,PewdiepieSubmissions
Opinion on Achhe Din has reversed in last eight months: Latest CSDS survey,https://imgur.com/a/wWB08,137,india
Oof,https://i.imgur.com/cf8pu8r.gifv,1819,BetterEveryLoop
Iced over bicycle after winter storm in Chicago.,https://www.reddit.com/r/mildlyinteresting/comments/7xflxy/iced_over_bicycle_after_winter_storm_in_chicago/,23.5k,mildlyinteresting
"TIL that in 2006, a young couple lost for three nights in the San Jacinto mountains was rescued in part by a signal fire started from matches found in the abandoned camp of a lost hiker who vanished exactly one year before their predicament.",https://www.backpacker.com/trips/lost-found,6634,todayilearned
"So after my previous washer broke I went out and bought a new one for $70, managed to complete the whole backyard",https://www.reddit.com/r/powerwashingporn/comments/7xfiww/so_after_my_previous_washer_broke_i_went_out_and/,11.6k,powerwashingporn
"7-yr-old’s body found in bed box: IAS aspirant used dead rats and perfumes to mask smell, said he was with CBI",https://www.hindustantimes.com/delhi-news/body-in-bed-box-dead-rats-perfumes-and-a-fake-persona-helped-him-conceal-murder/story-v7POB0t9aAfMirZqVbzm8K.html,66,india
Bros Without Borders,http://imgur.com/9Pfw7YE,14.5k,HumansBeingBros
Mid 80s Madison Wisconsin. My bike crew.,https://imgur.com/uRg41da,42.0k,OldSchoolCool
"I own a pencil that used to be owned by William Shakespeare, but he chewed it a lot",https://www.reddit.com/r/Jokes/comments/7xgkw1/i_own_a_pencil_that_used_to_be_owned_by_william/,863,Jokes
Entitled old woman grabs autistic kid.,https://www.reddit.com/r/IDontWorkHereLady/comments/7xftgg/entitled_old_woman_grabs_autistic_kid/,9347,IDontWorkHereLady
"Kohli vs ABD race to 10,000.",https://www.reddit.com/r/Cricket/comments/7xfu9x/kohli_vs_abd_race_to_10000/,82,Cricket
"No place for gods at Nashik Municipal Corporation, newly appointed IAS Tukaram Mundhe orders work places, desks to be cleared of religious imagery",http://www.thehindu.com/news/national/other-states/no-place-for-gods-at-nashik-municipal-corporation/article22746151.ece?utm_source=email,28,india
"State to buy 1.5 lakh books on PM Modi for schools, Congress alleges 'agenda'",http://indianexpress.com/article/india/state-to-buy-1-5-lakh-books-on-pm-modi-for-schools-congress-alleges-agenda-5063170/,81,india
Tonight’s CVS receipt for a $4 purchase,https://www.reddit.com/r/funny/comments/7xf9bm/tonights_cvs_receipt_for_a_4_purchase/,45.5k,funny
Happy Valentine's Day,https://www.reddit.com/r/dank_meme/comments/7xgya2/happy_valentines_day/,1031,dank_meme
"A timelapse of World War One, 1914-1918",https://i.imgur.com/cqtHcV0.gifv,2544,fakehistoryporn
"Fake Notes Of Rs 2,000 Printed In Pakistan Are Snaking Into India & You Can Do Nothing",https://www.indiatimes.com/culture/fake-notes-of-rs-2-000-printed-in-pakistan-are-snaking-into-india-you-can-do-nothing-339542.html?utm_source=FB&utm_medium=paid,29,india
Rundians summarized in a single pic.Updoot to make it reach regional front page.,https://www.reddit.com/r/bakchodi/comments/7xhf5e/rundians_summarized_in_a_single_picupdoot_to_make/,•,bakchodi
ITAP of my son meeting his great grandma,https://imgur.com/dZ5quoD,5041,itookapicture
What's going on here?,https://vgy.me/APACDS.jpg,71,Cricket
Comparing the middle orders of the top 5 (ICC rankings) ODI teams over the last 2 years,https://www.reddit.com/r/Cricket/comments/7xgwnn/comparing_the_middle_orders_of_the_top_5_icc/,38,Cricket
"“Voyage into dreams.”, Rachel Miller. Ink. 2018",https://www.reddit.com/r/Art/comments/7xfbfs/voyage_into_dreams_rachel_miller_ink_2018/,100,Art
John Cena being a generally good guy,https://www.reddit.com/r/MadeMeSmile/comments/7xalbr/john_cena_being_a_generally_good_guy/,810,MadeMeSmile
Don’t get discouraged. You’re in good hands.,https://i.imgur.com/jeB2F8z.jpg,107,CBTS_Stream
A.I. Algorithm Recognizes Terrorist Propaganda with 99 Percent Accuracy,https://www.inverse.com/article/41273-uk-company-creates-algorithm-to-flag-propaganda,28,technology
Meer dan 30.000 nieuwe nee-registraties na akkoord donorwet.,https://www.ad.nl/politiek/meer-dan-30-000-nieuwe-nee-registraties-na-akkoord-donorwet~a702acb5/,36,thenetherlands
"Bloody hell Don, not again!",https://www.reddit.com/r/CrappyDesign/comments/7xha2z/bloody_hell_don_not_again/,77,CrappyDesign
Hot 🔥,https://www.reddit.com/r/BellaThorne/comments/7xgsx4/hot/,41,BellaThorne
Netcode Analysis Megathread!,https://www.reddit.com/r/EscapefromTarkov/comments/7xc51d/netcode_analysis_megathread/,438,EscapefromTarkov
LTC is My Valentines,https://www.reddit.com/r/LitecoinMarkets/comments/7xgzcr/ltc_is_my_valentines/,33,LitecoinMarkets
Bloomberg has a Tesla Model 3 tracker,https://www.bloomberg.com/graphics/2018-tesla-tracker/,•,teslamotors
Let Him Sing,http://i.imgur.com/BbOxcrk.jpg,•,tumblr
"An optimist, a pessimist and a feminist walk into a bar.",https://www.reddit.com/r/darkjokes/comments/7xefj3/an_optimist_a_pessimist_and_a_feminist_walk_into/,153,darkjokes
My account is what?,https://www.reddit.com/r/softwaregore/comments/7xgypk/my_account_is_what/,90,softwaregore
I was honored with this look of love this morning.,https://www.reddit.com/r/blackcats/comments/7xdpx6/i_was_honored_with_this_look_of_love_this_morning/,211,blackcats
Saved this last year and forgot about it.,https://www.reddit.com/r/forwardsfromgrandma/comments/7xd1dx/saved_this_last_year_and_forgot_about_it/,282,forwardsfromgrandma
Jacqueline looks like a glowed up Liz Lemon.,https://www.reddit.com/r/thebachelor/comments/7xfjuu/jacqueline_looks_like_a_glowed_up_liz_lemon/,81,thebachelor
A Scam,https://i.imgur.com/6TW5OLz.jpg,47.8k,BlackPeopleTwitter
"0003 (Nikon F4s, tmax 400, Nikon 50mm 1.8d)",https://www.reddit.com/r/analog/comments/7xetat/0003_nikon_f4s_tmax_400_nikon_50mm_18d/,125,analog
"[Spoilers Chap 7) it's Valentine's Day, remember to declare your love for that special someone(s)!",https://www.reddit.com/r/Xenoblade_Chronicles/comments/7xhfx7/spoilers_chap_7_its_valentines_day_remember_to/,•,Xenoblade_Chronicles
"If you actually just mean popular opinion or sock puppets rather than PoW, please don't try to sound smart by calling it ""consensus""... I'm sick of hearing this.",https://www.reddit.com/r/btc/comments/7xhr25/if_you_actually_just_mean_popular_opinion_or_sock/,•,btc
"From 1785 to 1922, White Wolf, also known as Chief John Smith is considered the oldest Native American to have lived -- 137 years.",https://www.reddit.com/r/OldSchoolCool/comments/7xek4t/from_1785_to_1922_white_wolf_also_known_as_chief/,394,OldSchoolCool
Pollution lumineuse - Plus un seul endroit en France pour pouvoir apprécier pleinement la voie lactée,https://www.lightpollutionmap.info/#zoom=4&lat=6039727&lon=1009313&layers=B0FFFTFFFF,77,france
[JLC] First watch: Master Ultra Thin Reserve de Marche,https://www.reddit.com/r/Watches/comments/7xh72t/jlc_first_watch_master_ultra_thin_reserve_de/,27,Watches
Thanks! But you might want these back.,https://www.reddit.com/r/IDontWorkHereLady/comments/7xg8pz/thanks_but_you_might_want_these_back/,54,IDontWorkHereLady
"During his largest quaalude highin The Wolf of Wallstreet, Jordan Belfort is shown falling down a set of steps which, in a second shot, dramatically increases in number.",https://imgur.com/gallery/E9ftF,27,MovieDetails
Happy Valentine's Day from me and my Valentine.,https://i.redd.it/dhb9nsytp3g01.jpg,509,india
While the rest of the country is being terrorized by the Bajrang Dal... [x-post r/Kerala],https://i.imgur.com/tnEyERJ.jpg,246,india
its her 85th birthday today,https://pbs.twimg.com/media/DV92zyJWsAAC8c5.jpg,343,india
Valentine Day Special !,https://i.redd.it/ry0f8k17l4g01.jpg,203,india
"Being afraid to check your bank account is the adult version of being afraid to check your grades, while as a college student you are afraid to check both.",https://www.reddit.com/r/Showerthoughts/comments/7xgyjl/being_afraid_to_check_your_bank_account_is_the/,25.4k,Showerthoughts
India rise to No. 1 in ODI rankings,http://www.espncricinfo.com/story/_/id/22428133/india-rise-no.-1-odi-rankings,208,Cricket
Ahoy matey! Does this be arrrrr/evilbuildings?,https://i.imgur.com/lP9z0zn.jpg,4205,evilbuildings
WhatsApp University presents ‘Did u know?’,https://i.redd.it/qybagcedk4g01.jpg,96,india
Xiaomi Redmi Note 5 Pro preview: Possibly the best budget phone of 2018,https://www.androidcentral.com/xiaomi-redmi-note-5-pro,262,Android
"Sitting In Car, BJP Lawmaker Watches His Son Beat Up Toll Booth Worker",https://www.ndtv.com/india-news/sitting-in-car-bjp-lawmaker-pooran-prakash-watches-his-son-beat-up-toll-booth-worker-in-mathura-1812495,106,india
From an abusive ex,https://www.reddit.com/r/niceguys/comments/7xgkmt/from_an_abusive_ex/,11.1k,niceguys
Textiles in Shimla,https://i.redd.it/5h5bs7anl3g01.jpg,202,india
Mi TV 4 launched in India at price of 39999,https://i.redd.it/g1qt9ldry4g01.jpg,67,india
This is the first time in 20 years I didn’t get a Valentines Day Card from my secret admirer.,https://www.reddit.com/r/Jokes/comments/7xh6me/this_is_the_first_time_in_20_years_i_didnt_get_a/,789,Jokes
Why spread hate ?,https://i.imgur.com/igPUn4F.jpg,209,india
Honor India is Running Negative Twitter Campaign Against Xiaomi's Redmi Note 5 Launch! [Investigation with Proofs Attached],https://onphones.com/dear-honor-india-stop-cheap-marketing-tactics/1979/amp/,206,Android
India's current ODI run. Incredible !,https://www.reddit.com/r/Cricket/comments/7xfolb/indias_current_odi_run_incredible/,124,Cricket
#BREAKING - A complaint has been filed against the viral song featuring Priya Prakash Varrier for hurting Muslim sentiments at Falaknama Police station. The complaint says nothing against the actress.,https://twitter.com/CNNnews18/status/963632687482392577,94,india
My school's swedish textbook has PewDiePie in it,https://www.reddit.com/r/PewdiepieSubmissions/comments/7xgdse/my_schools_swedish_textbook_has_pewdiepie_in_it/,816,PewdiepieSubmissions
"nagaland election: After stopping Haj subsidy, BJP offers to send Christians to Jerusalem — for free - Times of India",https://m.timesofindia.com/india/after-stopping-haj-subsidy-bjp-offers-to-send-christians-to-jerusalem-for-free/amp_articleshow/62910805.cms?__twitter_impression=true,76,india
"""See Mom, I told you there was a red dot""",https://i.imgur.com/03XsYId.gifv,21.2k,Eyebleach
Me on valentine's day,https://www.reddit.com/r/PewdiepieSubmissions/comments/7xfbdf/me_on_valentines_day/,1948,PewdiepieSubmissions
"Forced to do sit-ups by teacher after hernia operation, class 7 boy undergoes surgery again",https://m.hindustantimes.com/india-news/forced-to-do-sit-ups-by-teacher-after-hernia-operation-class-7-boy-undergoes-surgery-again/story-HJsJbV1u6ysyb2GLSMRmJI.html,97,india
You guys need to stop spreading so much hatred against Pakistan/North Korea/ISIS/Taliban smh 😤😤😤😤😤😤,https://www.reddit.com/r/bakchodi/comments/7xgtqo/you_guys_need_to_stop_spreading_so_much_hatred/,29,bakchodi
:‘),https://www.reddit.com/r/marvelstudios/comments/7xgvns/_/,844,marvelstudios
Bich got rekt,https://www.reddit.com/r/PewdiepieSubmissions/comments/7xgoh9/bich_got_rekt/,567,PewdiepieSubmissions
Origami. A single sheet of paper.,https://i.imgur.com/0JCVeP8.gifv,48.8k,gifs
Instant regret from doggo,https://www.reddit.com/r/instant_regret/comments/7xgzim/instant_regret_from_doggo/,2846,instant_regret
"Contrast | Bandra Bandstand, Mumbai 2018",https://i.imgur.com/Mi6301U.jpg,147,india
India tried to stop cheating in school — so half a million students just skipped exams,https://www.washingtonpost.com/news/worldviews/wp/2018/02/09/india-tried-to-stop-cheating-in-school-so-half-a-million-students-just-skipped-exams/,157,india
The bottom of Uma Therman's shoe in Kill Bill flashes across the scene for about 1 second.,https://www.reddit.com/r/MovieDetails/comments/7xf162/the_bottom_of_uma_thermans_shoe_in_kill_bill/,19.9k,MovieDetails
To become a dominant movie streaming service,https://www.reddit.com/r/therewasanattempt/comments/7xf90c/to_become_a_dominant_movie_streaming_service/,24.0k,therewasanattempt
How to beat snake.,https://i.imgur.com/c91j0hJ.gifv,23.1k,gaming
Donald Trump slams India for high import tariffs on Harley-Davidson,http://www.thehindu.com/news/international/donald-trump-slams-india-for-high-import-tariffs-on-harley-davidson/article22748151.ece?homepage=true,111,india
A single Scot's motto on Valentine's,https://www.reddit.com/r/ScottishPeopleTwitter/comments/7xgjfe/a_single_scots_motto_on_valentines/,3516,ScottishPeopleTwitter
PEWDIEPIE RETURNING 📰Pew News📰,https://www.reddit.com/r/PewdiepieSubmissions/comments/7xgsnf/pewdiepie_returning_pew_news/,199,PewdiepieSubmissions
Opinion on Achhe Din has reversed in last eight months: Latest CSDS survey,https://imgur.com/a/wWB08,134,india
Oof,https://i.imgur.com/cf8pu8r.gifv,1825,BetterEveryLoop
Iced over bicycle after winter storm in Chicago.,https://www.reddit.com/r/mildlyinteresting/comments/7xflxy/iced_over_bicycle_after_winter_storm_in_chicago/,23.5k,mildlyinteresting
"TIL that in 2006, a young couple lost for three nights in the San Jacinto mountains was rescued in part by a signal fire started from matches found in the abandoned camp of a lost hiker who vanished exactly one year before their predicament.",https://www.backpacker.com/trips/lost-found,6657,todayilearned
"So after my previous washer broke I went out and bought a new one for $70, managed to complete the whole backyard",https://www.reddit.com/r/powerwashingporn/comments/7xfiww/so_after_my_previous_washer_broke_i_went_out_and/,11.7k,powerwashingporn
"7-yr-old’s body found in bed box: IAS aspirant used dead rats and perfumes to mask smell, said he was with CBI",https://www.hindustantimes.com/delhi-news/body-in-bed-box-dead-rats-perfumes-and-a-fake-persona-helped-him-conceal-murder/story-v7POB0t9aAfMirZqVbzm8K.html,68,india
Bros Without Borders,http://imgur.com/9Pfw7YE,14.5k,HumansBeingBros
Mid 80s Madison Wisconsin. My bike crew.,https://imgur.com/uRg41da,42.0k,OldSchoolCool
"I own a pencil that used to be owned by William Shakespeare, but he chewed it a lot",https://www.reddit.com/r/Jokes/comments/7xgkw1/i_own_a_pencil_that_used_to_be_owned_by_william/,864,Jokes
Entitled old woman grabs autistic kid.,https://www.reddit.com/r/IDontWorkHereLady/comments/7xftgg/entitled_old_woman_grabs_autistic_kid/,9352,IDontWorkHereLady
"Kohli vs ABD race to 10,000.",https://www.reddit.com/r/Cricket/comments/7xfu9x/kohli_vs_abd_race_to_10000/,78,Cricket
"No place for gods at Nashik Municipal Corporation, newly appointed IAS Tukaram Mundhe orders work places, desks to be cleared of religious imagery",http://www.thehindu.com/news/national/other-states/no-place-for-gods-at-nashik-municipal-corporation/article22746151.ece?utm_source=email,27,india
"State to buy 1.5 lakh books on PM Modi for schools, Congress alleges 'agenda'",http://indianexpress.com/article/india/state-to-buy-1-5-lakh-books-on-pm-modi-for-schools-congress-alleges-agenda-5063170/,78,india
Tonight’s CVS receipt for a $4 purchase,https://www.reddit.com/r/funny/comments/7xf9bm/tonights_cvs_receipt_for_a_4_purchase/,45.5k,funny
:‘),https://www.reddit.com/r/marvelstudios/comments/7xgvns/_/,847,marvelstudios
Donald Trump slams India for high import tariffs on Harley-Davidson,http://www.thehindu.com/news/international/donald-trump-slams-india-for-high-import-tariffs-on-harley-davidson/article22748151.ece?homepage=true,111,india
A single Scot's motto on Valentine's,https://www.reddit.com/r/ScottishPeopleTwitter/comments/7xgjfe/a_single_scots_motto_on_valentines/,3528,ScottishPeopleTwitter
"TIL that in 2006, a young couple lost for three nights in the San Jacinto mountains was rescued in part by a signal fire started from matches found in the abandoned camp of a lost hiker who vanished exactly one year before their predicament.",https://www.backpacker.com/trips/lost-found,6666,todayilearned
Punjab national bank reports $1.8 billion fraud at a Mumbai branch,https://www.ndtv.com/india-news/punjab-national-bank-reports-1-8-billion-fraud-at-a-mumbai-branch-1812491,61,india
"State to buy 1.5 lakh books on PM Modi for schools, Congress alleges 'agenda'",http://indianexpress.com/article/india/state-to-buy-1-5-lakh-books-on-pm-modi-for-schools-congress-alleges-agenda-5063170/,82,india
PEWDIEPIE RETURNING 📰Pew News📰,https://www.reddit.com/r/PewdiepieSubmissions/comments/7xgsnf/pewdiepie_returning_pew_news/,193,PewdiepieSubmissions
"7-yr-old’s body found in bed box: IAS aspirant used dead rats and perfumes to mask smell, said he was with CBI",https://www.hindustantimes.com/delhi-news/body-in-bed-box-dead-rats-perfumes-and-a-fake-persona-helped-him-conceal-murder/story-v7POB0t9aAfMirZqVbzm8K.html,69,india
Bros Without Borders,http://imgur.com/9Pfw7YE,14.5k,HumansBeingBros
Luke Shaw on Instagram - Happy Valentine’s Day Everyone 😍 @d_degeaofficial,https://instagram.com/p/BfLGcpyFAW6/,163,reddevils
Pills,https://gfycat.com/RespectfulZigzagAoudad,7219,woahdude
Oof,https://i.imgur.com/cf8pu8r.gifv,1822,BetterEveryLoop
"So after my previous washer broke I went out and bought a new one for $70, managed to complete the whole backyard",https://www.reddit.com/r/powerwashingporn/comments/7xfiww/so_after_my_previous_washer_broke_i_went_out_and/,11.7k,powerwashingporn
You guys need to stop spreading so much hatred against Pakistan/North Korea/ISIS/Taliban smh 😤😤😤😤😤😤,https://www.reddit.com/r/bakchodi/comments/7xgtqo/you_guys_need_to_stop_spreading_so_much_hatred/,26,bakchodi
Rundians summarized in a single pic.Updoot to make it reach regional front page.,https://www.reddit.com/r/bakchodi/comments/7xhf5e/rundians_summarized_in_a_single_picupdoot_to_make/,•,bakchodi
"I own a pencil that used to be owned by William Shakespeare, but he chewed it a lot",https://www.reddit.com/r/Jokes/comments/7xgkw1/i_own_a_pencil_that_used_to_be_owned_by_william/,866,Jokes
"Fake Notes Of Rs 2,000 Printed In Pakistan Are Snaking Into India & You Can Do Nothing",https://www.indiatimes.com/culture/fake-notes-of-rs-2-000-printed-in-pakistan-are-snaking-into-india-you-can-do-nothing-339542.html?utm_source=FB&utm_medium=paid,30,india
What are some foods you thought you hated but turned out your parents sucked at cooking them?,https://www.reddit.com/r/AskReddit/comments/7xfn4g/what_are_some_foods_you_thought_you_hated_but/,7670,AskReddit
Mid 80s Madison Wisconsin. My bike crew.,https://imgur.com/uRg41da,42.0k,OldSchoolCool
Comparing the middle orders of the top 5 (ICC rankings) ODI teams over the last 2 years,https://www.reddit.com/r/Cricket/comments/7xgwnn/comparing_the_middle_orders_of_the_top_5_icc/,33,Cricket
Last woman standing,https://www.reddit.com/r/ANormalDayInRussia/comments/7xgdma/last_woman_standing/,5464,ANormalDayInRussia
Mysterious clear liquid,https://www.reddit.com/r/youseeingthisshit/comments/7xfrhe/mysterious_clear_liquid/,6243,youseeingthisshit
"Me at 6 getting a ps1 for Christmas, a pivotal moment in my life- if you couldn't tell",https://imgur.com/lHvquBg,11.2k,gaming
"Kohli vs ABD race to 10,000.",https://www.reddit.com/r/Cricket/comments/7xfu9x/kohli_vs_abd_race_to_10000/,77,Cricket
What's going on here?,https://vgy.me/APACDS.jpg,66,Cricket
Watch this octopus disappear,https://www.reddit.com/r/blackmagicfuckery/comments/7xh0vc/watch_this_octopus_disappear/,108,blackmagicfuckery
Have this heart for Valentine's Day /r/jontron,https://www.reddit.com/r/JonTron/comments/7xhfrf/have_this_heart_for_valentines_day_rjontron/,•,JonTron
Kingdom Death: Monster was not what I was expecting,https://www.reddit.com/r/boardgames/comments/7xdgu0/kingdom_death_monster_was_not_what_i_was_expecting/,277,boardgames
Turkish FM: Turkey to provide 5 bil $ loan to Iraq,https://twitter.com/aacanli/status/963718805758365698,35,syriancivilwar
"Guys, wake up! Q is telling us the Nephilim bloodline and DNA manipulation are real!",https://www.reddit.com/r/CBTS_Stream/comments/7xes70/guys_wake_up_q_is_telling_us_the_nephilim/,157,CBTS_Stream
Sojin,https://www.reddit.com/r/kpics/comments/7xf9dk/sojin/,118,kpics
"Hundreds of people came out on short notice in Burlington VT to protest a Patriot Front demonstration, forcing the fascists to abandon their plans. This is proof that contesting fascists access to public space works.",https://socialistworker.org/2018/02/13/a-neo-nazi-flop-in-burlington,1475,socialism
Really?...,https://www.reddit.com/r/softwaregore/comments/7xg2id/really/,201,softwaregore
Destiny Gets SPOOKED,https://clips.twitch.tv/AggressiveAttractiveToothYee,688,LivestreamFail
When you find an 8x scope but have no weapons to put it on.,https://www.reddit.com/r/PUBG/comments/7xdv1v/when_you_find_an_8x_scope_but_have_no_weapons_to/,222,PUBG
ｌａｔｅ ｎｉｇｈｔ ど央ヌ,https://www.reddit.com/r/VaporwaveAesthetics/comments/7xgo3t/ｌａｔｅ_ｎｉｇｈｔ_ど央ヌ/,42,VaporwaveAesthetics
WCGW If I Annoy A Stranger At A Self-Service Car Wash?,https://gfycat.com/unfortunaterecklesseuropeanfiresalamander,1651,Whatcouldgowrong
Normie gets triggered over 4House meme,https://www.reddit.com/r/forsen/comments/7xf1kh/normie_gets_triggered_over_4house_meme/,125,forsen
"Jimmy Marr, a well known white supremacist showed up on my campus today",https://www.reddit.com/r/beholdthemasterrace/comments/7xennf/jimmy_marr_a_well_known_white_supremacist_showed/,152,beholdthemasterrace
TBS announced they are premiering episode 1 of Final Space exclusively on Reddit this Thursday,https://www.reddit.com/comments/7wg761/from_the_creative_mind_of_olan_rogers_final_space/,1033,television
