topic,url,votesWhen you feel confident in the Tide gif you just posted,https://i.imgur.com/JglWVPA.gifv,11.0k,HighQualityGifs
Female,https://www.reddit.com/r/CrappyDesign/comments/7xdl1v/female/,28.1k,CrappyDesign
2018 Mi Product Launch Summary,https://www.reddit.com/r/Xiaomi/comments/7xgkav/2018_mi_product_launch_summary/,30,Xiaomi
Origin: Dead Space 1 FREE for a limited time,https://www.origin.com/ind/en-us/store/dead-space/dead-space/standard-edition,8,IndianGaming
You tried.,https://www.reddit.com/r/softwaregore/comments/7xh2xj/you_tried/,258,softwaregore
"[Hype Thread] We are the Back-2-Back CL winning team, God Dammit!!",https://www.reddit.com/r/realmadrid/comments/7xh2q3/hype_thread_we_are_the_back2back_cl_winning_team/,32,realmadrid
Life Hack: keep the bands on the asparagus so it doesn’t roll all over while you cut the ends off.,https://www.reddit.com/r/lifehacks/comments/7xdpjg/life_hack_keep_the_bands_on_the_asparagus_so_it/,4897,lifehacks
The past tense of William Shakespeare would be Wouldiwas Shookspeared,https://www.reddit.com/r/Showerthoughts/comments/7xhh3m/the_past_tense_of_william_shakespeare_would_be/,•,Showerthoughts
Happy Valentines Day! -the Literature Club <3,https://www.reddit.com/r/DDLC/comments/7xex97/happy_valentines_day_the_literature_club_3/,3967,DDLC
"Bitcoin, Ethereum, Ripple price surge as cryptocurrency ban dismissed by European Central Bank",http://metro.co.uk/2018/02/14/price-bitcoin-ethereum-ripple-surges-european-central-bank-dismisses-cryptocurrency-ban-fears-7311566/,•,CryptoCurrency
HUMOR: What is your current position on the WB-Snyder situation?,https://www.reddit.com/r/DC_Cinematic/comments/7xg4sh/humor_what_is_your_current_position_on_the/,107,DC_Cinematic
Origami. A single sheet of paper.,https://i.imgur.com/0JCVeP8.gifv,1043,woahdude
"Nokia sells 4.4 million smartphones in Q4 2017, surpasses OnePlus, Google and others",http://www.techradar.com/news/nokia-sells-44-million-smartphones-in-q4-2017-surpasses-oneplus-google-and-others,5455,Android
"""Make him confess""",https://i.imgur.com/TqyuRTn.jpg,12.1k,freefolk
Found the aftermath of a pissed off Aokiji on the front page,https://i.imgur.com/1XofSZR.jpg,•,OnePiece
Kieron Dyer speaking the truth about Paul Scholes,https://imgur.com/VM032KP,327,reddevils
‘To ward off evil eye’: Andhra farmer puts up Sunny Leone poster to keep crop safe,https://m.hindustantimes.com/india-news/to-ward-off-their-evil-eye-andhra-farmer-puts-up-sunny-leone-poster-to-keep-crops-safe/story-nCWNMmK1H0EaW5nfJ3FGQK.html,25,india
Lyrics of the song Priya Varrier got famous for,https://i.imgur.com/sFErExa.jpg,8,india
"Owl Creek Pass, Colorado",http://i.imgur.com/DuMqW96.jpg,1926,MostBeautiful
My dad makes Lego Football grounds. Here is his Old Trafford,https://i.imgur.com/8jDa7zL.jpg,1615,reddevils
"Upgrade and refinished the desk, what ya'll think?",https://www.reddit.com/r/battlestations/comments/7xgin9/upgrade_and_refinished_the_desk_what_yall_think/,928,battlestations
"He Attac, He Respec, But most importantly HE IS COMING BACK SOON!!!😍😘",https://www.reddit.com/r/PewdiepieSubmissions/comments/7xhfnh/he_attac_he_respec_but_most_importantly_he_is/,•,PewdiepieSubmissions
Looking at Porto's games over the last 3 months and there tends to be...an interesting number of red cards in games involving them.,https://www.reddit.com/r/LiverpoolFC/comments/7xgifk/looking_at_portos_games_over_the_last_3_months/,155,LiverpoolFC
Please Stop Taking 'Celebrity Big Brother' Contestant Omarosa Seriously,http://www.hollywoodreporter.com/fien-print/critics-notebook-please-stop-taking-celebrity-big-brother-contestant-omarosa-seriously-1084338,5798,television
[Non-Political] Need your help to negotiate,https://www.reddit.com/r/india/comments/7xfj88/nonpolitical_need_your_help_to_negotiate/,26,india
"Pandya does it again, takes an amazing one handed catch while avoiding collision with Dhawan",https://www.reddit.com/r/Cricket/comments/7xbj7j/pandya_does_it_again_takes_an_amazing_one_handed/,218,Cricket
help,https://www.reddit.com/r/PewdiepieSubmissions/comments/7xhe47/help/,28,PewdiepieSubmissions
[Non-Political] Has AIB gone overboard with #PyaarEkDhokhaHai event?,https://www.reddit.com/r/india/comments/7xbxe3/nonpolitical_has_aib_gone_overboard_with/,129,india
"Taunting a bigger girl, WCGW?",https://i.imgur.com/f22pEfY.gifv,23.1k,Whatcouldgowrong
"Speeding Train Plows Into Elephants in India, Killing 5 Animals",https://www.nytimes.com/2018/02/12/world/asia/india-train-elephants.html,13,india
Zeus is blind but has an entire galaxy in his eyes,https://www.reddit.com/r/Superbowl/comments/7xg8k6/zeus_is_blind_but_has_an_entire_galaxy_in_his_eyes/,2832,Superbowl
HUMOR: Zack Attack,https://www.reddit.com/r/DC_Cinematic/comments/7xhdne/humor_zack_attack/,42,DC_Cinematic
Looks like a payment system is finally developed!,https://i.imgur.com/M0PLQrI.gifv,156,dogecoin
Valentine's Day Special: What's your favorite Indian Romantic Movie? [Ask],https://www.reddit.com/r/india/comments/7xfh8f/valentines_day_special_whats_your_favorite_indian/,25,india
Open Conversation with Raj Thakrey,https://www.reddit.com/r/india/comments/7xgfta/open_conversation_with_raj_thakrey/,18,india
"Bedum, just some little village in the Netherlands..",https://i.imgur.com/NzcKQHr.jpg,339,funny
Fatwa against Priya Varrier. *facepalm*,https://i.redd.it/cv8ziin0y5g01.png,9,india
worstfanbaseever.jpg,https://www.reddit.com/r/PewdiepieSubmissions/comments/7xgy9i/worstfanbaseeverjpg/,76,PewdiepieSubmissions
Warm place to sit,https://www.reddit.com/r/aww/comments/7xfan0/warm_place_to_sit/,1227,aww
HUMOR: When you see the runtime WB mandated for JL,https://www.reddit.com/r/DC_Cinematic/comments/7xd7fc/humor_when_you_see_the_runtime_wb_mandated_for_jl/,1519,DC_Cinematic
ULPT: You can win any argument against digitally illiterate people by setting up a fake website that proves your point,https://www.reddit.com/r/UnethicalLifeProTips/comments/7xcoun/ulpt_you_can_win_any_argument_against_digitally/,15.4k,UnethicalLifeProTips
Three Russian men are in the gulag talking with each other.,https://www.reddit.com/r/Jokes/comments/7xgxxi/three_russian_men_are_in_the_gulag_talking_with/,158,Jokes
Thanks Dodge! No way this was unintentional,https://www.reddit.com/r/ArcherFX/comments/7xdsyq/thanks_dodge_no_way_this_was_unintentional/,10.2k,ArcherFX
YSK That many lilies are poisonous to cats and can be fatal or result in severe kidney failure. Be careful when shopping for Valentine's Day bouquets if you have kitties!,https://www.reddit.com/r/YouShouldKnow/comments/7xfz4g/ysk_that_many_lilies_are_poisonous_to_cats_and/,911,YouShouldKnow
Nice truck I saw on highway 88.,https://www.reddit.com/r/AwesomeCarMods/comments/7xez76/nice_truck_i_saw_on_highway_88/,2619,AwesomeCarMods
WE HAVE TO DO IT,https://www.reddit.com/r/PewdiepieSubmissions/comments/7xcjnf/we_have_to_do_it/,2136,PewdiepieSubmissions
Rohit's score when he has run out kohli,https://www.reddit.com/r/Cricket/comments/7x9o4d/rohits_score_when_he_has_run_out_kohli/,528,Cricket
Cocaine bruh,https://www.reddit.com/r/indianpeoplequora/comments/7xgmyi/cocaine_bruh/,21,indianpeoplequora
LGBTQ week at NIT Calicut,https://imgur.com/fPQnCg5,22,Kerala
This is at a house in Singapore,https://www.reddit.com/r/Autos/comments/7xgx45/this_is_at_a_house_in_singapore/,434,Autos
"Without a doubt, my favorite Robin Williams movie is Mrs. Fire.",https://www.reddit.com/r/oneliners/comments/7xgwxg/without_a_doubt_my_favorite_robin_williams_movie/,76,oneliners
It's the Inside that counts,https://i.redd.it/l5ps35llb4dy.png,261,polandball
Penguins Can Be Scary Too,https://www.reddit.com/r/natureismetal/comments/7xdo30/penguins_can_be_scary_too/,4269,natureismetal
[CAN] Memento (2000): A man suffering from short-term memory loss tries to find his wife's murderer. Directed by Christopher Nolan.,https://www.netflix.com/title/60020435,6171,NetflixBestOf
Shaun White reclaims the Gold in Men's Halfpipe with a 97.75. Legend!,https://twitter.com/NBCOlympics/status/963610913642233856,46.9k,videos
"Okay, what is up with this sub",https://www.reddit.com/r/OnePiece/comments/7xh9z7/okay_what_is_up_with_this_sub/,16,OnePiece
Free Meals,https://www.reddit.com/r/ShittyLifeProTips/comments/7xd6dj/free_meals/,14.1k,ShittyLifeProTips
[uncensored-r/CryptoCurrency] lucyd is working towards decentralizing the,https://www.reddit.com/r/noncensored_bitcoin/comments/7xg4fc/uncensoredrcryptocurrency_lucyd_is_working/,25,noncensored_bitcoin
Are people really dumb enough to fall for this? Apparently... LoL,https://www.reddit.com/r/CryptoCurrency/comments/7xgcl1/are_people_really_dumb_enough_to_fall_for_this/,177,CryptoCurrency
I regret everything,https://www.reddit.com/r/funny/comments/7xdjjc/i_regret_everything/,9297,funny
Mother father puja day,https://ashramorgblog.files.wordpress.com/2015/02/3-copy.jpg,29,bakchodi
"We rescued an old, worried chub today. She's unsure of her new family, but she'll come around soon.",https://www.reddit.com/r/Delightfullychubby/comments/7xeed1/we_rescued_an_old_worried_chub_today_shes_unsure/,7299,Delightfullychubby
Tyrone,https://www.reddit.com/r/PewdiepieSubmissions/comments/7xfcko/tyrone/,580,PewdiepieSubmissions
"TIL if you're ordering and paying for extra ingredients at an U.S. restaurant you're paying on the average a 426% mark-up for extra sour cream, 417% for cheese on a burger, and 525% for any ingredients on a pizza. An unidentified pizza chain has a 636% mark up for meat in their ""meat-laden"" pizza.",http://time.com/money/4734877/restaurant-prices-food-markups-guacamole-pizza/,4836,todayilearned
"Happy Valenti- wait, something doesn’t seem right here",https://www.reddit.com/r/deathnote/comments/7xguya/happy_valenti_wait_something_doesnt_seem_right/,58,deathnote
Facebook’s ‘Protect’ feature on iOS essentially installs spyware on iPhone and iPad,https://9to5mac.com/2018/02/13/facebook-protect-spyware-ios/,4312,apple
Meirl,https://www.reddit.com/r/meirl/comments/7xd6ia/meirl/,9498,meirl
Sonam kapoor deep cleavage,https://www.reddit.com/r/HQDesi/comments/7xh8an/sonam_kapoor_deep_cleavage/,14,HQDesi
"Denying Nehru his due | Were ancient Indian polities democratic, democracy thus representing India’s enduring culture? And what was Jawahar Lal Nehru’s role in institutionalising democracy?",http://indianexpress.com/article/opinion/columns/nehru-modi-gandhi-ambedkar-constitution-electoral-democracy-denying-his-due-5062844/,8,india
Is this Messi?,https://media.giphy.com/media/xThta21uVU2dsN1TdS/giphy.gif,84,MCFC
Smart boye likes to keep up with what’s going on in the world.,https://www.reddit.com/r/rarepuppers/comments/7xfh29/smart_boye_likes_to_keep_up_with_whats_going_on/,1639,rarepuppers
Zinda? - your life in 6 minutes.,https://www.youtube.com/watch?v=N1Cb6aYSvks,11,india
Was looking up how to solder small surface mount components and... damn,https://youtu.be/5uiroWBkdFY,170,EngineeringPorn
Squad goals,https://www.reddit.com/r/indianpeoplefacebook/comments/7xc6k6/squad_goals/,23.1k,indianpeoplefacebook
"This is Sara, she loves checking cows and would be besties with Hitler if he had cows to check",https://www.reddit.com/r/dogswithjobs/comments/7xgtu0/this_is_sara_she_loves_checking_cows_and_would_be/,509,dogswithjobs
"Scientists have developed a brain implant that noticeably boosted memory in its first serious test run, perhaps offering a promising new strategy to treat dementia, traumatic brain injuries and other conditions that damage memory.",https://www.nytimes.com/2018/02/06/health/brain-implant-memory.html,26.8k,science
Man locks his head in a cage in an attempt to quit smoking. Wife has the key and only opens it for meals [xpost /ANormalDayInRussia],https://www.reddit.com/r/stopsmoking/comments/7xh79g/man_locks_his_head_in_a_cage_in_an_attempt_to/,37,stopsmoking
THEKEY announces two HUGE partnerships with Multibillion Companies,https://www.reddit.com/r/CryptoCurrency/comments/7xg1mf/thekey_announces_two_huge_partnerships_with/,247,CryptoCurrency
Found this gem,https://www.reddit.com/r/terriblefacebookmemes/comments/7xg9ss/found_this_gem/,514,terriblefacebookmemes
Saw this gem at Target. Happy v day hmf!,https://imgur.com/FUBi00j,4336,holdmyfries
I can relate,https://www.reddit.com/r/tumblr/comments/7xdifc/i_can_relate/,13.3k,tumblr
"The modern version of the road to Valyria, actual location is at the Great Rann of Kutch. [OC][5984x3366]",https://i.redd.it/lq3pd20we6g01.jpg,•,india
Germany proposes free public transport to lower urban emissions,https://economictimes.indiatimes.com/news/international/world-news/germany-proposes-free-public-transport-to-lower-urban-emissions/articleshow/62911731.cms,1292,worldnews
Finally got these bad boys framed up!,https://www.reddit.com/r/lotr/comments/7xgiro/finally_got_these_bad_boys_framed_up/,596,lotr
IRL Spiderman,https://gfycat.com/weaksardonichoneybadger,2663,gifs
"Bill Gates: It's 'scary to me' that technology can empower small groups to do great harm - ""A small group can have an impact — in the case of nuclear [weapons], on millions; and in the case of bio[terror], on billions. That is scary to me.""",https://www.cnbc.com/2018/02/13/bill-gates-technology-can-empower-small-groups-to-cause-harm.html,14.8k,Futurology
The truth..,https://www.reddit.com/r/Memes_Of_The_Dank/comments/7xh6pi/the_truth/,71,Memes_Of_The_Dank
ADA to be supported on the Finney Smartphone- Emurgo and SIRIN LABS Announce Partnership,https://www.chipin.com/emurgo-sirin-labs-announce-partnership/,36,cardano
Sky-high blop from the cutest co-pilot!,https://www.reddit.com/r/blop/comments/7xh6nk/skyhigh_blop_from_the_cutest_copilot/,186,blop
Do I call a plumber or electrician?,https://www.reddit.com/r/funny/comments/7xdhpp/do_i_call_a_plumber_or_electrician/,14.0k,funny
Bengal becomes first state to opt out of ‘Modicare’ - Times of India,https://timesofindia.indiatimes.com/india/bengal-becomes-first-state-to-opt-out-of-modicare/articleshow/62908154.cms,67,india
Found this on fb feed,https://imgur.com/tnEyERJ,20,Kerala
Last Minute Porto Scouting Report,https://www.reddit.com/r/LiverpoolFC/comments/7xfew0/last_minute_porto_scouting_report/,183,LiverpoolFC
India has killed 63 million of its daughters through sex-selection abortion,https://www.lifesitenews.com/news/india-has-killed-63-million-of-its-daughters-through-sex-selection-abortion,126,india
Stolenued.,https://www.reddit.com/r/Memes_Of_The_Dank/comments/7xgi99/stolenued/,155,Memes_Of_The_Dank
I had a wet dream: Razer sorted out their software issues and came to India.,https://www.reddit.com/r/IndianGaming/comments/7xg0iz/i_had_a_wet_dream_razer_sorted_out_their_software/,15,IndianGaming
"Australian politician who was against same sex marriage because of ""The sanctity of marriage"" ended his own marriage of twenty five years this week because his secretary is pregnant with his baby.",http://www.news.com.au/national/politics/barnaby-joyce-and-exstaff-member-vikki-campion-reportedly-expecting-a-baby/news-story/38619bde2a7f307a9576ec9a55538d94,558,nottheonion
Have you Seen the Facebook adverts in Indian newspapers? Does this mean we have reached social media saturation?,https://www.reddit.com/r/india/comments/7xh69v/have_you_seen_the_facebook_adverts_in_indian/,3,india
Take the shot.,https://i.imgur.com/7sQNkJ7.gifv,1091,whitepeoplegifs
Call me The Flash,https://gfycat.com/CorruptOilyBlackrhino,38,gifs
Wifebeaters,http://www.caglecartoons.com/media/cartoons/139/2018/02/13/206613_600.jpg,16.1k,PoliticalHumor
[Humor] #Breaking: Bajrang Dal has launched an Android App for tracking couples making out in public. Bajrang Dal Chief has urged all the singles around the country to notify any couple making out in public with a just a tap. #ValentinesDay,https://twitter.com/pci_news_/status/963633087837065216,12,IndiaSpeaks
Edge,https://www.reddit.com/r/PornhubComments/comments/7xgs4b/edge/,166,PornhubComments
Match Thread: World Cricket League Division 2 - Windhoek - Crunch Time,https://www.reddit.com/r/Cricket/comments/7xghjk/match_thread_world_cricket_league_division_2/,24,Cricket
Cute as a button,https://i.imgur.com/Lou3hP4.gifv,•,babyelephantgifs
Muted,https://i.imgur.com/LMbDix4.jpg,3173,MechanicalKeyboards
Happy Valentine’s Day!,https://www.reddit.com/r/OreGairuSNAFU/comments/7xh4j3/happy_valentines_day/,54,OreGairuSNAFU
"After stopping Haj subsidy, BJP offers to send Christians to Jerusalem — for free - Times of India",https://timesofindia.indiatimes.com/india/after-stopping-haj-subsidy-bjp-offers-to-send-christians-to-jerusalem-for-free/articleshow/62910805.cms,13,IndiaSpeaks
Real Madrid | PSG: Let's make history together again,https://youtu.be/30NwCrOiggA,•,realmadrid
Found this happy old boy outside a supermarket. Many bellehrubs ensued.,https://www.reddit.com/r/rarepuppers/comments/7xeff3/found_this_happy_old_boy_outside_a_supermarket/,4744,rarepuppers
Carra on the plane to Portugal with Liverpool fans,https://twitter.com/Carra23/status/963694026649202688,75,LiverpoolFC
[humor] Where are you going..,https://www.reddit.com/r/Brawlstars/comments/7xh3ze/humor_where_are_you_going/,47,Brawlstars
"Zeus, a blind owl, looks like he has stars in his eyes",https://www.reddit.com/r/aww/comments/7xetvf/zeus_a_blind_owl_looks_like_he_has_stars_in_his/,3844,aww
"TIL Marvel's near collapse led to dominance. In The 90’s they desperately sold film rights to their characters for operating capital. A few hits(Blade & X-Men) led studios to consider the comic movie viable. Failure by most caused many of the rights to return to Marvel, who created Marvel Studios.",http://www.bbc.com/news/entertainment-arts-32379661,5357,todayilearned
[WP] My German Shepard had to be put down today. We never knew where he came from. Please write about his adventures.,https://www.reddit.com/r/WritingPrompts/comments/7xd14t/wp_my_german_shepard_had_to_be_put_down_today_we/,16.4k,WritingPrompts
"Why play connect four, when you can play connect fo............",https://www.reddit.com/r/PewdiepieSubmissions/comments/7xfbcp/why_play_connect_four_when_you_can_play_connect_fo/,268,PewdiepieSubmissions
This happened about a year ago but I’m still wondering what he was thinking with this opening,https://www.reddit.com/r/creepyPMs/comments/7xeypo/this_happened_about_a_year_ago_but_im_still/,2362,creepyPMs
[R]Rant: Facing hurdles in getting a vasectomy done because I'm unmarried.,https://www.reddit.com/r/india/comments/7xaixq/rrant_facing_hurdles_in_getting_a_vasectomy_done/,177,india
"The BBC is to ban single-use plastics by 2020, after TV series Blue Planet II highlighted the scale of sea pollution.",http://www.bbc.co.uk/news/uk-43051153,13.9k,UpliftingNews
South Korea’s government gave the strongest signal yet that it will allow cryptocurrency exchanges to keep operating in the country,https://www.bloomberg.com/news/articles/2018-02-14/crypto-trading-ban-downplayed-by-south-korea-after-backlash?utm_content=crypto&utm_campaign=socialflow-organic&utm_source=twitter&utm_medium=social,316,CryptoCurrency
PNB Nirav Modi Case: How The $1.8 Billion Fraud Detected At PNB Unfolded,https://www.bloombergquint.com/business/2018/02/14/the-nirav-modi-case-how-the-18-billion-fraud-detected-at-pnb-unfolded,•,IndiaSpeaks
When you realize Pewdiepie isn’t coming back for another whole week,https://www.reddit.com/r/PewdiepieSubmissions/comments/7xdt16/when_you_realize_pewdiepie_isnt_coming_back_for/,516,PewdiepieSubmissions
"Roses are Red, Dogs Have Four Legs...",https://imgur.com/axortuh,3378,boottoobig
"My girlfriend is doing a Star Wars contract for her art class, this was her first piece!",https://www.reddit.com/r/StarWars/comments/7xe0l9/my_girlfriend_is_doing_a_star_wars_contract_for/,23.4k,StarWars
What is the thing we learned from cyberbullying?,https://www.reddit.com/r/darkjokes/comments/7xe4go/what_is_the_thing_we_learned_from_cyberbullying/,645,darkjokes
Just arrived from /All. Am I doing this right?,https://www.reddit.com/r/GatoradeBath/comments/7xgeyp/just_arrived_from_all_am_i_doing_this_right/,904,GatoradeBath
Lords to host a West Indies vs. World XI T20 match to raise funds for cricket facilities,http://www.cricket.com.au/news/west-indies-rest-of-the-world-xi-lords-t20-charity-money-raised-hurricanes/2018-02-14,55,Cricket
2 new awesome Dany Funkos S7,https://www.reddit.com/r/freefolk/comments/7xhnk4/2_new_awesome_dany_funkos_s7/,•,freefolk
Everything about this image is sad,https://i.imgur.com/G0tzYgH.jpg,574,sadcringe
'Earth One' Hal Jordan by Gabriel Hardman,https://i.redd.it/bg14g7idm2g01.jpg,1758,comicbooks
20 up votes or I'll drop the rock and kill him,https://www.reddit.com/r/Breath_of_the_Wild/comments/7xb2se/20_up_votes_or_ill_drop_the_rock_and_kill_him/,15.1k,Breath_of_the_Wild
That friend who spends too long on their notes,https://www.reddit.com/r/PenmanshipPorn/comments/7xdev6/that_friend_who_spends_too_long_on_their_notes/,2399,PenmanshipPorn
Vegan Figure Skater Wins Gold at Winter Olympics,https://www.reddit.com/r/vegan/comments/7xeyik/vegan_figure_skater_wins_gold_at_winter_olympics/,1078,vegan
Mt. Rainier this weekend. Taken from an airplane with a Sony A7Rii,https://www.reddit.com/r/Seattle/comments/7xfj7h/mt_rainier_this_weekend_taken_from_an_airplane/,773,Seattle
I was so giddy to type this out,https://www.reddit.com/r/puns/comments/7xe1uv/i_was_so_giddy_to_type_this_out/,1676,puns
I miss her lots,https://www.reddit.com/r/MonsterHunter/comments/7xgcb1/i_miss_her_lots/,468,MonsterHunter
Gov. Tom Wolf (D-PA) rejects Republican drawn Pennsylvania congressional map.,https://www.governor.pa.gov/governor-tom-wolf-rejects-partisan-gerrymandered-map/,10.6k,BlueMidterm2018
She obviously loves the pets,https://www.reddit.com/r/teefies/comments/7xe7d8/she_obviously_loves_the_pets/,1531,teefies
[Image] Don't know why. But this is always a go to for when I need a quick pick me up. Innocent and so true.,https://www.reddit.com/r/GetMotivated/comments/7xfg49/image_dont_know_why_but_this_is_always_a_go_to/,2631,GetMotivated
Late Stage Capitalism in a nutshell,https://www.reddit.com/r/CringeAnarchy/comments/7xd7d1/late_stage_capitalism_in_a_nutshell/,3135,CringeAnarchy
Black toilet paper,https://gfycat.com/WelllitLateBoilweevil,7521,INEEEEDIT
"‘Reason is non-negotiable’: Steven Pinker on the Enlightenment - “The Scientific Revolution was revolutionary in a way that is hard to appreciate today, now that its discoveries have become second nature to most of us.”",https://www.theguardian.com/books/2018/feb/11/reason-is-non-negotioable-steven-pinker-enlightenment-now-extract,6258,philosophy
Ken M on fried chicken,https://i.imgur.com/rRXZynR.jpg,16.3k,KenM
I am here!,https://www.reddit.com/r/awwwtf/comments/7xbbzs/i_am_here/,6614,awwwtf
You have 20 seconds to comply.,https://www.reddit.com/r/lego/comments/7xgrzj/you_have_20_seconds_to_comply/,326,lego
He Who Cannot Open The Gate,https://www.reddit.com/r/harrypotter/comments/7xah5p/he_who_cannot_open_the_gate/,19.0k,harrypotter
SV: I’m under 200 lbs for the first time since I was 15!,https://www.reddit.com/r/loseit/comments/7xebvo/sv_im_under_200_lbs_for_the_first_time_since_i/,1358,loseit
Prins Henrik är död. Vi framför våra kondoleanser till våra bröder och systrar i söder. Länge leve Danmark och kärleken mellan våra länder!,https://upload.wikimedia.org/wikipedia/commons/a/a9/Glava_kyrka_1989.jpg,382,SWARJE
Epic fail,https://i.imgur.com/dPy6KvY.gifv,638,BigCatGifs
I'm throwing my hat in the ring for the National party leadership,https://www.reddit.com/r/newzealand/comments/7xebhd/im_throwing_my_hat_in_the_ring_for_the_national/,1347,newzealand
Are architectural memes allowed here?,https://www.reddit.com/r/Kanye/comments/7xeftq/are_architectural_memes_allowed_here/,1270,Kanye
White Nationalist...Reggae?,https://scontent.ford1-1.fna.fbcdn.net/v/t1.0-9/27752360_298466197344803_2284360655542401216_n.jpg?oh=c5e536412806fbf15f170bfc52f4bc1e&oe=5ADB7786,732,beholdthemasterrace
It's Always Sunny in Dolby Theater,https://i.redd.it/dghsvzfde0g01.jpg,11.1k,IASIP
me_irl,https://i.imgur.com/wRMUwRZ.jpg,720,TheSimpsons
"My queen bee tattoo by LOGAN ISAACSON at Speakeasy Tattoo Co in Boone, NC",https://imgur.com/GmvzlSf,1795,tattoos
Happy Valentine's Day from me and my Valentine.,https://i.redd.it/dhb9nsytp3g01.jpg,511,india
While the rest of the country is being terrorized by the Bajrang Dal... [x-post r/Kerala],https://i.imgur.com/tnEyERJ.jpg,244,india
its her 85th birthday today,https://pbs.twimg.com/media/DV92zyJWsAAC8c5.jpg,346,india
Valentine Day Special !,https://i.redd.it/ry0f8k17l4g01.jpg,204,india
"Being afraid to check your bank account is the adult version of being afraid to check your grades, while as a college student you are afraid to check both.",https://www.reddit.com/r/Showerthoughts/comments/7xgyjl/being_afraid_to_check_your_bank_account_is_the/,25.8k,Showerthoughts
India rise to No. 1 in ODI rankings,http://www.espncricinfo.com/story/_/id/22428133/india-rise-no.-1-odi-rankings,204,Cricket
Ahoy matey! Does this be arrrrr/evilbuildings?,https://i.imgur.com/lP9z0zn.jpg,4264,evilbuildings
WhatsApp University presents ‘Did u know?’,https://i.redd.it/qybagcedk4g01.jpg,98,india
Xiaomi Redmi Note 5 Pro preview: Possibly the best budget phone of 2018,https://www.androidcentral.com/xiaomi-redmi-note-5-pro,261,Android
"Sitting In Car, BJP Lawmaker Watches His Son Beat Up Toll Booth Worker",https://www.ndtv.com/india-news/sitting-in-car-bjp-lawmaker-pooran-prakash-watches-his-son-beat-up-toll-booth-worker-in-mathura-1812495,109,india
