topic,url,votesTottenham are the first team to overturn a two-goal deficit at the Allianz Stadium since Juventus moved there in 2011.,https://twitter.com/SpursBlog_the/status/963714563551227904,91,coys
"Close up King Cobra, having a drink",https://i.imgur.com/V0PcjDY.gifv,6936,gifs
Google's more excited than me for Valentine's Day,https://imgur.com/GcnfuXR,22,india
India’s $230 million plan to stop crop burning that pollutes Delhi falls short of estimates,http://www.livemint.com/Politics/myjv1duIqqTuFDZC7zIobM/Indias-230-million-plan-to-stop-crop-burning-that-pollutes.html,5,india
"A picture of both of my Grandpas, who were friends before my parents even met.",https://www.reddit.com/r/pics/comments/7xgmfi/a_picture_of_both_of_my_grandpas_who_were_friends/,370,pics
A police officer was assigned to hunt a dangerous cannibal on his first day on the job,https://www.reddit.com/r/Jokes/comments/7xenao/a_police_officer_was_assigned_to_hunt_a_dangerous/,261,Jokes
"Quote of the Day: ""If Hindutva is sustained on a cow’s legs, it will come crashing down at the slightest sign of a crisis.”~V.D.Savarkar [P]",https://www.reddit.com/r/indianews/comments/7xgar9/quote_of_the_day_if_hindutva_is_sustained_on_a/,9,indianews
We will pay India in its own coin for any misadventure: Pakistan,http://www.moneycontrol.com/news/world/we-will-pay-india-in-its-own-coin-for-any-misadventure-pakistan-2507373.html,5,india
This is why we memorize our seed words,https://www.reddit.com/r/CryptoCurrency/comments/7xfru9/this_is_why_we_memorize_our_seed_words/,229,CryptoCurrency
"“If you took Donald Bradman as he was and put him in a Test Match today, they’d kill him” ... Discuss.",https://www.reddit.com/r/Cricket/comments/7xgyz9/if_you_took_donald_bradman_as_he_was_and_put_him/,2,Cricket
The greatest foreign object ever used in a wrestling match.,https://imgur.com/kLZxROJ,•,SCJerk
how are you pewdiepie,https://www.reddit.com/r/PewdiepieSubmissions/comments/7xbd59/how_are_you_pewdiepie/,5581,PewdiepieSubmissions
Obama's actual portrait,https://i.imgur.com/0sM21Y8.gifv,92.5k,gifs
Fortress Monastery by Tze Kun Chin,https://cdnb.artstation.com/p/assets/images/images/008/975/335/large/tze-kun-chin-fortress-monestary.jpg?1516402173,1353,ImaginaryLandscapes
Adam Sandler got a t-shirt from a fan and actually wore it weeks later,https://i.imgur.com/jBNM274.jpg,•,pics
Enigma - Scalable privacy for any blockchain!,https://imgur.com/a/tKKp6,•,CryptoCurrency
Get it at your local gamestop,https://www.reddit.com/r/PewdiepieSubmissions/comments/7xgkvb/get_it_at_your_local_gamestop/,83,PewdiepieSubmissions
"Redditor ""regoapps"" reveals he has faked is identity as a multi-millionare despite being verified on facebook and having one of the top AMA's of all time on reddit",https://np.reddit.com/r/UnethicalLifeProTips/comments/7xcoun/ulpt_you_can_win_any_argument_against_digitally/du7xhii/,485,bestof
PewDiePie Cucked,https://www.reddit.com/r/PewdiepieSubmissions/comments/7xgxlb/pewdiepie_cucked/,34,PewdiepieSubmissions
Ashley Cole to captain LA Galaxy for 2018 season,https://www.lagconfidential.com/2018/2/11/17001504/ashley-cole-is-your-2018-la-galaxy-captain,277,chelseafc
I know the names of more One Piece characters than I do real people,https://www.reddit.com/r/OnePiece/comments/7xgxgy/i_know_the_names_of_more_one_piece_characters/,139,OnePiece
"Whenever I go back to this spot, it takes my breath away. Kananaskis, Alberta [OC] [1000x966]",https://www.reddit.com/r/EarthPorn/comments/7xcsd2/whenever_i_go_back_to_this_spot_it_takes_my/,36.4k,EarthPorn
Have it your way,https://www.reddit.com/r/Memes_Of_The_Dank/comments/7xg8ca/have_it_your_way/,75,Memes_Of_The_Dank
"Wow, in South Korea you can walk into exchanges and get in person support... in the US it takes 2 weeks to get an email reply.",http://www.globalcryptopress.com/2018/02/winter-olympics-host-south-korea-and.html,339,CryptoCurrency
Aja leading her gay army into battle,https://www.reddit.com/r/rupaulsdragrace/comments/7xfovv/aja_leading_her_gay_army_into_battle/,1355,rupaulsdragrace
You don’t realize how small your bathroom is until you take the mirror off the wall.,https://www.reddit.com/r/Showerthoughts/comments/7xf1bk/you_dont_realize_how_small_your_bathroom_is_until/,521,Showerthoughts
Indian bank PNB says detects $1.77 billion worth of fraudulent transactions,https://www.reuters.com/article/us-punjab-natl-bank-fraud/indian-bank-pnb-says-detects-1-77-billion-worth-of-fraudulent-transactions-idUSKCN1FY0CV?il=0,13,india
Old but gold,https://www.reddit.com/r/PewdiepieSubmissions/comments/7xde3r/old_but_gold/,354,PewdiepieSubmissions
"An undocumented immigrant who called police to report a burglary was himself arrested, while the suspect was allowed to go free",http://www.bbc.com/news/world-us-canada-43039044,1511,news
Mary Jane by Artgerm,https://i.redd.it/f56zjpg064g01.jpg,95,comicbooks
"MALCOLM: Half of prospective Boushie jurors were Aboriginal, says member of jury pool",http://torontosun.com/news/national/malcolm-half-of-prospective-boushie-jurors-were-aboriginal-says-member-of-jury-pool,163,canada
"Senaat stemt in met donorwet, Nederlanders voortaan automatisch donor",http://nu.nl/algemeen/5131493/senaat-stemt-in-met-donorwet-nederlanders-voortaan-automatisch-donor.html,1237,thenetherlands
The search for Barb now extends to the farthest reaches of Brunswick,https://www.reddit.com/r/melbourne/comments/7xenmz/the_search_for_barb_now_extends_to_the_farthest/,174,melbourne
Custom R9T,https://www.reddit.com/r/motorcycles/comments/7xffo7/custom_r9t/,111,motorcycles
"IL selvitti: Nelikymppiset kansanedustajat ovat eduskunnan lottovoittajia - Jutta Urpilaisen, 42, sopeutumiseläkkeen arvo peräti 1,2 miljoonaa euroa",http://www.iltalehti.fi/politiikka/201802132200741358_pi.shtml,104,Suomi
Yoel Romero's Cross-Armed Guard,https://gfycat.com/MistyShimmeringAlbertosaurus,2833,MMA
[MAIN SPOILERS] Jon and Benjen's conversation in Winterfell,https://www.reddit.com/r/gameofthrones/comments/7xfx6r/main_spoilers_jon_and_benjens_conversation_in/,85,gameofthrones
Momo's Bizzare Adventure,https://www.reddit.com/r/BokuNoHeroAcademia/comments/7xefwf/momos_bizzare_adventure/,194,BokuNoHeroAcademia
"Goldfish (Minolta Automat, 75mm, Portra 400)",https://www.reddit.com/r/analog/comments/7xcono/goldfish_minolta_automat_75mm_portra_400/,425,analog
We need some oases added to Miramar,"https://fthmb.tqn.com/V9xgguEQ7fcElrY4SIhyNa490J0=/2121x1414/filters:fill(auto,1)/GettyImages-140208932-596f5c3722fa3a00113928c2.jpg",2864,PUBATTLEGROUNDS
Big Bird inspects the merchandise,https://i.imgur.com/IJEjQ11.jpg,72,bertstrips
Recreating Sylva or Google:Skylines,https://i.imgur.com/ksg2KVS.jpg,318,CitiesSkylines
Watch this octopus disappear,https://www.reddit.com/r/blackmagicfuckery/comments/7xh0vc/watch_this_octopus_disappear/,112,blackmagicfuckery
Valentine Day Special !,https://i.redd.it/ry0f8k17l4g01.jpg,206,india
2meirl4meirl,https://i.redd.it/bekzx3t9p4g01.jpg,194,2meirl4meirl
"Reading in the woods, Upstate New York.",https://i.imgur.com/Aaw1FWJ.jpg,1646,CozyPlaces
Not the only blind person at the tram stop.,https://www.reddit.com/r/IDontWorkHereLady/comments/7xft1n/not_the_only_blind_person_at_the_tram_stop/,89,IDontWorkHereLady
White Russia,https://i.imgur.com/K9i754z.png,95,polandball
"Kurnoth Hunters for my Bog Sylvaneth project, The Dirge",https://www.reddit.com/r/Warhammer/comments/7xc8v7/kurnoth_hunters_for_my_bog_sylvaneth_project_the/,483,Warhammer
Clothlurker Tishurtus,https://www.reddit.com/r/Bossfight/comments/7xgv3b/clothlurker_tishurtus/,42,Bossfight
"[Async, C#] One user scenario to rule them all",https://blogs.msdn.microsoft.com/seteplia/2018/02/14/one-user-scenario-to-rule-them-all/,103,programming
Woman drops her hat,https://i.imgur.com/tOjuCcY.gifv,440,MadeMeSmile
"🅱️UNSHOTS, 🅱️REAMS, E🅱️LOSIONS: I S L O O P",https://i.redd.it/ggbul5ilh2g01.jpg,747,DeepFriedMemes
Two strokes later and shes still the happiest old pup ive ever seen!,https://imgur.com/2taQDow,447,dogpictures
me💞irl,https://www.reddit.com/r/Polska/comments/7xghzo/meirl/,53,Polska
France in 1852 [OC],https://www.reddit.com/r/HistoryMemes/comments/7xdvus/france_in_1852_oc/,681,HistoryMemes
EVERY MAN A LYRIC (part 2),https://i.imgur.com/3FvJNhp.png,50,Kaiserreich
Rank 1 Dkayed tilted by what statistically is a 1% possibility,https://www.reddit.com/r/DuelLinks/comments/7xfhc8/rank_1_dkayed_tilted_by_what_statistically_is_a_1/,106,DuelLinks
"Leftist Defends North Korea, Says 'F*** America.' Shapiro Smashes Him.",https://www.dailywire.com/news/27110/leftist-defends-north-korea-says-f-america-shapiro-daily-wire,228,Conservative
Paul Krugman: Trump's Infrastructure Plan Was a Always a Scam. The celebrity mogul has never had any interest in serving the public.,https://www.alternet.org/news-amp-politics/donald-trump-infrastructure-scam,537,democrats
What happens when you design teddy bears with a 3 year old. Made these to chase away nightmares for my son.,https://imgur.com/aAN7LN4,787,crafts
We’re having cat for dinner.,https://www.reddit.com/r/catpictures/comments/7xeus2/were_having_cat_for_dinner/,143,catpictures
Our purrincess before and after she was rescued from the streets,https://www.reddit.com/r/blackcats/comments/7x9lw6/our_purrincess_before_and_after_she_was_rescued/,1424,blackcats
My iPhone 7's camera is amazing,https://www.reddit.com/r/iphone/comments/7xgk6c/my_iphone_7s_camera_is_amazing/,52,iphone
I 3d-printed and painted this seethrough-Wings-Dragon using clear filament!,https://i.redd.it/i8ls34touzf01.jpg,•,3Dprinting
"My first one. By Gunnar, Element Tattoo, Oslo. Done at the Milan Tattoo Convention.",https://www.reddit.com/r/tattoos/comments/7xbu77/my_first_one_by_gunnar_element_tattoo_oslo_done/,1589,tattoos
What's going on here?,https://vgy.me/APACDS.jpg,70,Cricket
"Guys, wake up! Q is telling us the Nephilim bloodline and DNA manipulation are real!",https://www.reddit.com/r/CBTS_Stream/comments/7xes70/guys_wake_up_q_is_telling_us_the_nephilim/,154,CBTS_Stream
Have this heart for Valentine's Day /r/jontron,https://www.reddit.com/r/JonTron/comments/7xhfrf/have_this_heart_for_valentines_day_rjontron/,•,JonTron
Kingdom Death: Monster was not what I was expecting,https://www.reddit.com/r/boardgames/comments/7xdgu0/kingdom_death_monster_was_not_what_i_was_expecting/,275,boardgames
Turkish FM: Turkey to provide 5 bil $ loan to Iraq,https://twitter.com/aacanli/status/963718805758365698,34,syriancivilwar
Sojin,https://www.reddit.com/r/kpics/comments/7xf9dk/sojin/,115,kpics
Really?...,https://www.reddit.com/r/softwaregore/comments/7xg2id/really/,202,softwaregore
"Hundreds of people came out on short notice in Burlington VT to protest a Patriot Front demonstration, forcing the fascists to abandon their plans. This is proof that contesting fascists access to public space works.",https://socialistworker.org/2018/02/13/a-neo-nazi-flop-in-burlington,1477,socialism
Destiny Gets SPOOKED,https://clips.twitch.tv/AggressiveAttractiveToothYee,692,LivestreamFail
Paratroopers of the 101st Airborne Division displaying a captured Nazi flag in Normandy [800x660],https://i.imgur.com/X8oHaod.jpg,57,HistoryPorn
When you find an 8x scope but have no weapons to put it on.,https://www.reddit.com/r/PUBG/comments/7xdv1v/when_you_find_an_8x_scope_but_have_no_weapons_to/,224,PUBG
MRW I realise it's Valentine's Day,https://gfycat.com/PinkGlumGalapagostortoise,•,startrekgifs
"Jimmy Marr, a well known white supremacist showed up on my campus today",https://www.reddit.com/r/beholdthemasterrace/comments/7xennf/jimmy_marr_a_well_known_white_supremacist_showed/,150,beholdthemasterrace
Happy Valentine's Day from me and my Valentine.,https://i.redd.it/dhb9nsytp3g01.jpg,509,india
While the rest of the country is being terrorized by the Bajrang Dal... [x-post r/Kerala],https://i.imgur.com/tnEyERJ.jpg,250,india
its her 85th birthday today,https://pbs.twimg.com/media/DV92zyJWsAAC8c5.jpg,349,india
Valentine Day Special !,https://i.redd.it/ry0f8k17l4g01.jpg,206,india
"Being afraid to check your bank account is the adult version of being afraid to check your grades, while as a college student you are afraid to check both.",https://www.reddit.com/r/Showerthoughts/comments/7xgyjl/being_afraid_to_check_your_bank_account_is_the/,26.1k,Showerthoughts
India rise to No. 1 in ODI rankings,http://www.espncricinfo.com/story/_/id/22428133/india-rise-no.-1-odi-rankings,203,Cricket
Ahoy matey! Does this be arrrrr/evilbuildings?,https://i.imgur.com/lP9z0zn.jpg,4307,evilbuildings
WhatsApp University presents ‘Did u know?’,https://i.redd.it/qybagcedk4g01.jpg,100,india
Xiaomi Redmi Note 5 Pro preview: Possibly the best budget phone of 2018,https://www.androidcentral.com/xiaomi-redmi-note-5-pro,260,Android
"Sitting In Car, BJP Lawmaker Watches His Son Beat Up Toll Booth Worker",https://www.ndtv.com/india-news/sitting-in-car-bjp-lawmaker-pooran-prakash-watches-his-son-beat-up-toll-booth-worker-in-mathura-1812495,106,india
This is the first time in 20 years I didn’t get a Valentines Day Card from my secret admirer.,https://www.reddit.com/r/Jokes/comments/7xh6me/this_is_the_first_time_in_20_years_i_didnt_get_a/,845,Jokes
Textiles in Shimla,https://i.redd.it/5h5bs7anl3g01.jpg,208,india
From an abusive ex,https://www.reddit.com/r/niceguys/comments/7xgkmt/from_an_abusive_ex/,11.4k,niceguys
Mi TV 4 launched in India at price of 39999,https://i.redd.it/g1qt9ldry4g01.jpg,71,india
Why spread hate ?,https://i.imgur.com/igPUn4F.jpg,208,india
#BREAKING - A complaint has been filed against the viral song featuring Priya Prakash Varrier for hurting Muslim sentiments at Falaknama Police station. The complaint says nothing against the actress.,https://twitter.com/CNNnews18/status/963632687482392577,100,india
Honor India is Running Negative Twitter Campaign Against Xiaomi's Redmi Note 5 Launch! [Investigation with Proofs Attached],https://onphones.com/dear-honor-india-stop-cheap-marketing-tactics/1979/amp/,205,Android
India's current ODI run. Incredible !,https://www.reddit.com/r/Cricket/comments/7xfolb/indias_current_odi_run_incredible/,128,Cricket
My school's swedish textbook has PewDiePie in it,https://www.reddit.com/r/PewdiepieSubmissions/comments/7xgdse/my_schools_swedish_textbook_has_pewdiepie_in_it/,817,PewdiepieSubmissions
"nagaland election: After stopping Haj subsidy, BJP offers to send Christians to Jerusalem — for free - Times of India",https://m.timesofindia.com/india/after-stopping-haj-subsidy-bjp-offers-to-send-christians-to-jerusalem-for-free/amp_articleshow/62910805.cms?__twitter_impression=true,76,india
:‘),https://www.reddit.com/r/marvelstudios/comments/7xgvns/_/,859,marvelstudios
"""See Mom, I told you there was a red dot""",https://i.imgur.com/03XsYId.gifv,21.3k,Eyebleach
Me on valentine's day,https://www.reddit.com/r/PewdiepieSubmissions/comments/7xfbdf/me_on_valentines_day/,1965,PewdiepieSubmissions
"Forced to do sit-ups by teacher after hernia operation, class 7 boy undergoes surgery again",https://m.hindustantimes.com/india-news/forced-to-do-sit-ups-by-teacher-after-hernia-operation-class-7-boy-undergoes-surgery-again/story-HJsJbV1u6ysyb2GLSMRmJI.html,93,india
You guys need to stop spreading so much hatred against Pakistan/North Korea/ISIS/Taliban smh 😤😤😤😤😤😤,https://www.reddit.com/r/bakchodi/comments/7xgtqo/you_guys_need_to_stop_spreading_so_much_hatred/,28,bakchodi
Bich got rekt,https://www.reddit.com/r/PewdiepieSubmissions/comments/7xgoh9/bich_got_rekt/,575,PewdiepieSubmissions
Origami. A single sheet of paper.,https://i.imgur.com/0JCVeP8.gifv,49.1k,gifs
Instant regret from doggo,https://www.reddit.com/r/instant_regret/comments/7xgzim/instant_regret_from_doggo/,3028,instant_regret
"Contrast | Bandra Bandstand, Mumbai 2018",https://i.imgur.com/Mi6301U.jpg,142,india
India tried to stop cheating in school — so half a million students just skipped exams,https://www.washingtonpost.com/news/worldviews/wp/2018/02/09/india-tried-to-stop-cheating-in-school-so-half-a-million-students-just-skipped-exams/,159,india
The bottom of Uma Therman's shoe in Kill Bill flashes across the scene for about 1 second.,https://www.reddit.com/r/MovieDetails/comments/7xf162/the_bottom_of_uma_thermans_shoe_in_kill_bill/,20.0k,MovieDetails
To become a dominant movie streaming service,https://www.reddit.com/r/therewasanattempt/comments/7xf90c/to_become_a_dominant_movie_streaming_service/,24.1k,therewasanattempt
How to beat snake.,https://i.imgur.com/c91j0hJ.gifv,23.2k,gaming
Donald Trump slams India for high import tariffs on Harley-Davidson,http://www.thehindu.com/news/international/donald-trump-slams-india-for-high-import-tariffs-on-harley-davidson/article22748151.ece?homepage=true,108,india
A single Scot's motto on Valentine's,https://www.reddit.com/r/ScottishPeopleTwitter/comments/7xgjfe/a_single_scots_motto_on_valentines/,3643,ScottishPeopleTwitter
PEWDIEPIE RETURNING 📰Pew News📰,https://www.reddit.com/r/PewdiepieSubmissions/comments/7xgsnf/pewdiepie_returning_pew_news/,203,PewdiepieSubmissions
Opinion on Achhe Din has reversed in last eight months: Latest CSDS survey,https://imgur.com/a/wWB08,138,india
Oof,https://i.imgur.com/cf8pu8r.gifv,1900,BetterEveryLoop
Iced over bicycle after winter storm in Chicago.,https://www.reddit.com/r/mildlyinteresting/comments/7xflxy/iced_over_bicycle_after_winter_storm_in_chicago/,23.8k,mildlyinteresting
"TIL that in 2006, a young couple lost for three nights in the San Jacinto mountains was rescued in part by a signal fire started from matches found in the abandoned camp of a lost hiker who vanished exactly one year before their predicament.",https://www.backpacker.com/trips/lost-found,7025,todayilearned
"So after my previous washer broke I went out and bought a new one for $70, managed to complete the whole backyard",https://www.reddit.com/r/powerwashingporn/comments/7xfiww/so_after_my_previous_washer_broke_i_went_out_and/,11.8k,powerwashingporn
"No place for gods at Nashik Municipal Corporation, newly appointed IAS Tukaram Mundhe orders work places, desks to be cleared of religious imagery",http://www.thehindu.com/news/national/other-states/no-place-for-gods-at-nashik-municipal-corporation/article22746151.ece?utm_source=email,29,india
"7-yr-old’s body found in bed box: IAS aspirant used dead rats and perfumes to mask smell, said he was with CBI",https://www.hindustantimes.com/delhi-news/body-in-bed-box-dead-rats-perfumes-and-a-fake-persona-helped-him-conceal-murder/story-v7POB0t9aAfMirZqVbzm8K.html,70,india
Bros Without Borders,http://imgur.com/9Pfw7YE,14.6k,HumansBeingBros
Mid 80s Madison Wisconsin. My bike crew.,https://imgur.com/uRg41da,42.2k,OldSchoolCool
"I own a pencil that used to be owned by William Shakespeare, but he chewed it a lot",https://www.reddit.com/r/Jokes/comments/7xgkw1/i_own_a_pencil_that_used_to_be_owned_by_william/,894,Jokes
Happy Valentine's Day,https://www.reddit.com/r/dank_meme/comments/7xgya2/happy_valentines_day/,1066,dank_meme
Entitled old woman grabs autistic kid.,https://www.reddit.com/r/IDontWorkHereLady/comments/7xftgg/entitled_old_woman_grabs_autistic_kid/,9444,IDontWorkHereLady
"Kohli vs ABD race to 10,000.",https://www.reddit.com/r/Cricket/comments/7xfu9x/kohli_vs_abd_race_to_10000/,80,Cricket
"State to buy 1.5 lakh books on PM Modi for schools, Congress alleges 'agenda'",http://indianexpress.com/article/india/state-to-buy-1-5-lakh-books-on-pm-modi-for-schools-congress-alleges-agenda-5063170/,84,india
"Kohli vs ABD race to 10,000.",https://www.reddit.com/r/Cricket/comments/7xfu9x/kohli_vs_abd_race_to_10000/,81,Cricket
Tonight’s CVS receipt for a $4 purchase,https://www.reddit.com/r/funny/comments/7xf9bm/tonights_cvs_receipt_for_a_4_purchase/,45.9k,funny
"A timelapse of World War One, 1914-1918",https://i.imgur.com/cqtHcV0.gifv,2601,fakehistoryporn
"Fake Notes Of Rs 2,000 Printed In Pakistan Are Snaking Into India & You Can Do Nothing",https://www.indiatimes.com/culture/fake-notes-of-rs-2-000-printed-in-pakistan-are-snaking-into-india-you-can-do-nothing-339542.html?utm_source=FB&utm_medium=paid,31,india
Rundians summarized in a single pic.Updoot to make it reach regional front page.,https://www.reddit.com/r/bakchodi/comments/7xhf5e/rundians_summarized_in_a_single_picupdoot_to_make/,•,bakchodi
ITAP of my son meeting his great grandma,https://imgur.com/dZ5quoD,5058,itookapicture
What's going on here?,https://vgy.me/APACDS.jpg,68,Cricket
Comparing the middle orders of the top 5 (ICC rankings) ODI teams over the last 2 years,https://www.reddit.com/r/Cricket/comments/7xgwnn/comparing_the_middle_orders_of_the_top_5_icc/,35,Cricket
Kagiso Rabada has been fined 15% of his match fee and handed one demerit point for breaching the ICC Code of Conduct during fifth,https://twitter.com/cricbuzz/status/963710629826633728,32,Cricket
Last woman standing,https://www.reddit.com/r/ANormalDayInRussia/comments/7xgdma/last_woman_standing/,5651,ANormalDayInRussia
Luke Shaw on Instagram - Happy Valentine’s Day Everyone 😍 @d_degeaofficial,https://instagram.com/p/BfLGcpyFAW6/,161,reddevils
Instagram shitposting edit.,https://www.reddit.com/r/PewdiepieSubmissions/comments/7xgrl3/instagram_shitposting_edit/,181,PewdiepieSubmissions
"Me at 6 getting a ps1 for Christmas, a pivotal moment in my life- if you couldn't tell",https://imgur.com/lHvquBg,11.5k,gaming
Punjab national bank reports $1.8 billion fraud at a Mumbai branch,https://www.ndtv.com/india-news/punjab-national-bank-reports-1-8-billion-fraud-at-a-mumbai-branch-1812491,59,india
Kitty and her horse friend 🐱🐴,https://gfycat.com/SmoggyPartialBlackfish,12.1k,AnimalsBeingBros
[Rant] Data privacy is joke and India is a country which keeps on giving.,https://www.reddit.com/r/india/comments/7xftmu/rant_data_privacy_is_joke_and_india_is_a_country/,44,india
A prank in a Scottish pub,https://i.imgur.com/FdZ9yPh.gifv,21.7k,MadeMeSmile
Secret of birth.,https://www.reddit.com/r/funny/comments/7xexo0/secret_of_birth/,6518,funny
SpaceX to launch its satellite internet prototypes this weekend,https://www.engadget.com/2018/02/13/spacex-launch-satellite-internet-starlink/,8102,technology
The pro's of not having a famous alter ego,https://i.imgur.com/DjxQTfD.jpg,6054,funny
Happy MahaShivRaatri,https://i.redd.it/q20rbbcng3g01.jpg,61,india
What are some foods you thought you hated but turned out your parents sucked at cooking them?,https://www.reddit.com/r/AskReddit/comments/7xfn4g/what_are_some_foods_you_thought_you_hated_but/,7879,AskReddit
[Image] Don't know why. But this is always a go to for when I need a quick pick me up. Innocent and so true.,https://www.reddit.com/r/GetMotivated/comments/7xfg49/image_dont_know_why_but_this_is_always_a_go_to/,2645,GetMotivated
Pills,https://gfycat.com/RespectfulZigzagAoudad,7297,woahdude
"Don’t use Huawei phones, say heads of FBI, CIA, and NSA",https://www.theverge.com/2018/2/14/17011246/huawei-phones-safe-us-intelligence-chief-fears,154,Android
Damn freshies,https://i.redd.it/ivmbr1ee53g01.jpg,22.4k,teenagers
Raj karega Khalsa!,http://indiachan.com/static/images/1518354366594804.jpg,21,bakchodi
India tourism grows 8.4%,http://www.ttrweekly.com/site/2018/02/india-tourism-grows-8-4/,64,india
Mysterious clear liquid,https://www.reddit.com/r/youseeingthisshit/comments/7xfrhe/mysterious_clear_liquid/,6300,youseeingthisshit
Puppy Barkours down the stairs [x-post from r/aww],https://i.imgur.com/cLqhrPt.gifv,5414,barkour
Ebay gamer sharing the love,https://i.imgur.com/dziTC93.jpg,2867,gaming
"New Dutch law makes every adult an organ donor. Netherlands narrowly passed new legislation on that will register every citizen aged 18 and over as a potential organ donor, unless they explicitly choose to opt out.",http://www.dw.com/en/new-dutch-law-makes-every-adult-an-organ-donor/a-42576784,1776,worldnews
False news promoted by mainstream Indian media has become a major embarrassment for India,https://twitter.com/trtworld/status/963457766227566592,40,india
A R Rahman on Amul Surabhi,https://www.youtube.com/watch?v=rqeEegDzDDM,45,india
"“Thanks man, I’ll give your headphones back in a few days!”",https://www.reddit.com/r/mildlyinfuriating/comments/7xegg6/thanks_man_ill_give_your_headphones_back_in_a_few/,12.2k,mildlyinfuriating
"Manged to log into my 4th grade ifunny account, I will post every unfunny meme everyday until I run out",https://www.reddit.com/r/ComedyCemetery/comments/7xfquo/manged_to_log_into_my_4th_grade_ifunny_account_i/,4657,ComedyCemetery
This remarkable photo shows a single atom trapped by electric fields. Shot by David Nadlinger (University of Oxford). This picture was taken through a window of the ultra-high vacuum chamber that houses the trap.,https://www.reddit.com/r/Physics/comments/7xhcu1/this_remarkable_photo_shows_a_single_atom_trapped/,296,Physics
How to NOT do the robbery,https://gfycat.com/InexperiencedQualifiedAmericanrobin,•,funny
[Image] Some earthBound motivation!,https://www.reddit.com/r/GetMotivated/comments/7xdepe/image_some_earthbound_motivation/,18.5k,GetMotivated
To the guy who gave me $1,https://www.reddit.com/r/TwoXChromosomes/comments/7xgqgk/to_the_guy_who_gave_me_1/,676,TwoXChromosomes
"Xiaomi Redmi Note 5 Pro with Snapdragon 636 and dual cameras launched, prices start at Rs 13,999",https://hub.91mobiles.com/xiaomi-redmi-note-5-pro-india-launch-price-specifications-features/?utm_source=twitter&utm_medium=post,111,Android
Punjab minister flips coin to decide on posting of lecturers,https://m.timesofindia.com/india/punjab-minister-flips-coin-to-decide-on-posting-of-lecturers/articleshow/62903942.cms,44,india
