topic,url,votesRight next door...,https://www.reddit.com/r/crappyoffbrands/comments/7xf0ge/right_next_door/,1257,crappyoffbrands
"In Alaska, snow plows are able to plow the streets without blocking in driveways.",https://gfycat.com/IllfatedSilverKarakul,1453,specializedtools
"I just realized Cubert is Hubert, but with a c for clone",https://www.reddit.com/r/futurama/comments/7xb7e5/i_just_realized_cubert_is_hubert_but_with_a_c_for/,12.1k,futurama
"Orang Itan, The Schemer",https://www.reddit.com/r/Bossfight/comments/7xb2xv/orang_itan_the_schemer/,17.7k,Bossfight
"Watch and learn, boys.",https://www.reddit.com/r/OSHA/comments/7xayua/watch_and_learn_boys/,13.5k,OSHA
My frugal valentine’s gift cost less than $20,https://www.reddit.com/r/Frugal/comments/7xe0yd/my_frugal_valentines_gift_cost_less_than_20/,2035,Frugal
How do you guys feel about guns?,https://www.reddit.com/r/standupshots/comments/7xb72t/how_do_you_guys_feel_about_guns/,14.9k,standupshots
It's the Inside that counts,https://i.redd.it/l5ps35llb4dy.png,267,polandball
Anjanath that I made ~ and ~ Nergigante is next!,https://www.reddit.com/r/MonsterHunterWorld/comments/7xgx5s/anjanath_that_i_made_and_nergigante_is_next/,347,MonsterHunterWorld
This coke bottle,https://www.reddit.com/r/2healthbars/comments/7xc5xs/this_coke_bottle/,5475,2healthbars
Happy Valentine's Day from me and my Valentine.,https://i.redd.it/dhb9nsytp3g01.jpg,509,india
While the rest of the country is being terrorized by the Bajrang Dal... [x-post r/Kerala],https://i.imgur.com/tnEyERJ.jpg,243,india
its her 85th birthday today,https://pbs.twimg.com/media/DV92zyJWsAAC8c5.jpg,346,india
Valentine Day Special !,https://i.redd.it/ry0f8k17l4g01.jpg,204,india
"Being afraid to check your bank account is the adult version of being afraid to check your grades, while as a college student you are afraid to check both.",https://www.reddit.com/r/Showerthoughts/comments/7xgyjl/being_afraid_to_check_your_bank_account_is_the/,26.4k,Showerthoughts
India rise to No. 1 in ODI rankings,http://www.espncricinfo.com/story/_/id/22428133/india-rise-no.-1-odi-rankings,206,Cricket
Ahoy matey! Does this be arrrrr/evilbuildings?,https://i.imgur.com/lP9z0zn.jpg,4368,evilbuildings
WhatsApp University presents ‘Did u know?’,https://i.redd.it/qybagcedk4g01.jpg,101,india
Xiaomi Redmi Note 5 Pro preview: Possibly the best budget phone of 2018,https://www.androidcentral.com/xiaomi-redmi-note-5-pro,265,Android
"Sitting In Car, BJP Lawmaker Watches His Son Beat Up Toll Booth Worker",https://www.ndtv.com/india-news/sitting-in-car-bjp-lawmaker-pooran-prakash-watches-his-son-beat-up-toll-booth-worker-in-mathura-1812495,107,india
This is the first time in 20 years I didn’t get a Valentines Day Card from my secret admirer.,https://www.reddit.com/r/Jokes/comments/7xh6me/this_is_the_first_time_in_20_years_i_didnt_get_a/,879,Jokes
Textiles in Shimla,https://i.redd.it/5h5bs7anl3g01.jpg,206,india
From an abusive ex,https://www.reddit.com/r/niceguys/comments/7xgkmt/from_an_abusive_ex/,11.5k,niceguys
Mi TV 4 launched in India at price of 39999,https://i.redd.it/g1qt9ldry4g01.jpg,73,india
Why spread hate ?,https://i.imgur.com/igPUn4F.jpg,206,india
#BREAKING - A complaint has been filed against the viral song featuring Priya Prakash Varrier for hurting Muslim sentiments at Falaknama Police station. The complaint says nothing against the actress.,https://twitter.com/CNNnews18/status/963632687482392577,98,india
Honor India is Running Negative Twitter Campaign Against Xiaomi's Redmi Note 5 Launch! [Investigation with Proofs Attached],https://onphones.com/dear-honor-india-stop-cheap-marketing-tactics/1979/amp/,206,Android
India's current ODI run. Incredible !,https://www.reddit.com/r/Cricket/comments/7xfolb/indias_current_odi_run_incredible/,125,Cricket
My school's swedish textbook has PewDiePie in it,https://www.reddit.com/r/PewdiepieSubmissions/comments/7xgdse/my_schools_swedish_textbook_has_pewdiepie_in_it/,819,PewdiepieSubmissions
"nagaland election: After stopping Haj subsidy, BJP offers to send Christians to Jerusalem — for free - Times of India",https://m.timesofindia.com/india/after-stopping-haj-subsidy-bjp-offers-to-send-christians-to-jerusalem-for-free/amp_articleshow/62910805.cms?__twitter_impression=true,76,india
:‘),https://www.reddit.com/r/marvelstudios/comments/7xgvns/_/,864,marvelstudios
"""See Mom, I told you there was a red dot""",https://i.imgur.com/03XsYId.gifv,21.4k,Eyebleach
Me on valentine's day,https://www.reddit.com/r/PewdiepieSubmissions/comments/7xfbdf/me_on_valentines_day/,1976,PewdiepieSubmissions
"Forced to do sit-ups by teacher after hernia operation, class 7 boy undergoes surgery again",https://m.hindustantimes.com/india-news/forced-to-do-sit-ups-by-teacher-after-hernia-operation-class-7-boy-undergoes-surgery-again/story-HJsJbV1u6ysyb2GLSMRmJI.html,96,india
You guys need to stop spreading so much hatred against Pakistan/North Korea/ISIS/Taliban smh 😤😤😤😤😤😤,https://www.reddit.com/r/bakchodi/comments/7xgtqo/you_guys_need_to_stop_spreading_so_much_hatred/,27,bakchodi
Bich got rekt,https://www.reddit.com/r/PewdiepieSubmissions/comments/7xgoh9/bich_got_rekt/,574,PewdiepieSubmissions
Origami. A single sheet of paper.,https://i.imgur.com/0JCVeP8.gifv,49.3k,gifs
Instant regret from doggo,https://www.reddit.com/r/instant_regret/comments/7xgzim/instant_regret_from_doggo/,3104,instant_regret
"Contrast | Bandra Bandstand, Mumbai 2018",https://i.imgur.com/Mi6301U.jpg,143,india
India tried to stop cheating in school — so half a million students just skipped exams,https://www.washingtonpost.com/news/worldviews/wp/2018/02/09/india-tried-to-stop-cheating-in-school-so-half-a-million-students-just-skipped-exams/,158,india
The bottom of Uma Therman's shoe in Kill Bill flashes across the scene for about 1 second.,https://www.reddit.com/r/MovieDetails/comments/7xf162/the_bottom_of_uma_thermans_shoe_in_kill_bill/,20.1k,MovieDetails
To become a dominant movie streaming service,https://www.reddit.com/r/therewasanattempt/comments/7xf90c/to_become_a_dominant_movie_streaming_service/,24.2k,therewasanattempt
How to beat snake.,https://i.imgur.com/c91j0hJ.gifv,23.2k,gaming
Donald Trump slams India for high import tariffs on Harley-Davidson,http://www.thehindu.com/news/international/donald-trump-slams-india-for-high-import-tariffs-on-harley-davidson/article22748151.ece?homepage=true,105,india
A single Scot's motto on Valentine's,https://www.reddit.com/r/ScottishPeopleTwitter/comments/7xgjfe/a_single_scots_motto_on_valentines/,3695,ScottishPeopleTwitter
PEWDIEPIE RETURNING 📰Pew News📰,https://www.reddit.com/r/PewdiepieSubmissions/comments/7xgsnf/pewdiepie_returning_pew_news/,203,PewdiepieSubmissions
Opinion on Achhe Din has reversed in last eight months: Latest CSDS survey,https://imgur.com/a/wWB08,138,india
Oof,https://i.imgur.com/cf8pu8r.gifv,1941,BetterEveryLoop
Iced over bicycle after winter storm in Chicago.,https://www.reddit.com/r/mildlyinteresting/comments/7xflxy/iced_over_bicycle_after_winter_storm_in_chicago/,23.9k,mildlyinteresting
"TIL that in 2006, a young couple lost for three nights in the San Jacinto mountains was rescued in part by a signal fire started from matches found in the abandoned camp of a lost hiker who vanished exactly one year before their predicament.",https://www.backpacker.com/trips/lost-found,7203,todayilearned
"So after my previous washer broke I went out and bought a new one for $70, managed to complete the whole backyard",https://www.reddit.com/r/powerwashingporn/comments/7xfiww/so_after_my_previous_washer_broke_i_went_out_and/,11.8k,powerwashingporn
"No place for gods at Nashik Municipal Corporation, newly appointed IAS Tukaram Mundhe orders work places, desks to be cleared of religious imagery",http://www.thehindu.com/news/national/other-states/no-place-for-gods-at-nashik-municipal-corporation/article22746151.ece?utm_source=email,29,india
"7-yr-old’s body found in bed box: IAS aspirant used dead rats and perfumes to mask smell, said he was with CBI",https://www.hindustantimes.com/delhi-news/body-in-bed-box-dead-rats-perfumes-and-a-fake-persona-helped-him-conceal-murder/story-v7POB0t9aAfMirZqVbzm8K.html,68,india
Bros Without Borders,http://imgur.com/9Pfw7YE,14.6k,HumansBeingBros
Mid 80s Madison Wisconsin. My bike crew.,https://imgur.com/uRg41da,42.3k,OldSchoolCool
"I own a pencil that used to be owned by William Shakespeare, but he chewed it a lot",https://www.reddit.com/r/Jokes/comments/7xgkw1/i_own_a_pencil_that_used_to_be_owned_by_william/,904,Jokes
Happy Valentine's Day,https://www.reddit.com/r/dank_meme/comments/7xgya2/happy_valentines_day/,1091,dank_meme
Entitled old woman grabs autistic kid.,https://www.reddit.com/r/IDontWorkHereLady/comments/7xftgg/entitled_old_woman_grabs_autistic_kid/,9485,IDontWorkHereLady
"State to buy 1.5 lakh books on PM Modi for schools, Congress alleges 'agenda'",http://indianexpress.com/article/india/state-to-buy-1-5-lakh-books-on-pm-modi-for-schools-congress-alleges-agenda-5063170/,83,india
"Kohli vs ABD race to 10,000.",https://www.reddit.com/r/Cricket/comments/7xfu9x/kohli_vs_abd_race_to_10000/,81,Cricket
Tonight’s CVS receipt for a $4 purchase,https://www.reddit.com/r/funny/comments/7xf9bm/tonights_cvs_receipt_for_a_4_purchase/,46.1k,funny
"A timelapse of World War One, 1914-1918",https://i.imgur.com/cqtHcV0.gifv,2637,fakehistoryporn
"Fake Notes Of Rs 2,000 Printed In Pakistan Are Snaking Into India & You Can Do Nothing",https://www.indiatimes.com/culture/fake-notes-of-rs-2-000-printed-in-pakistan-are-snaking-into-india-you-can-do-nothing-339542.html?utm_source=FB&utm_medium=paid,28,india
Rundians summarized in a single pic.Updoot to make it reach regional front page.,https://www.reddit.com/r/bakchodi/comments/7xhf5e/rundians_summarized_in_a_single_picupdoot_to_make/,•,bakchodi
ITAP of my son meeting his great grandma,https://imgur.com/dZ5quoD,5081,itookapicture
What's going on here?,https://vgy.me/APACDS.jpg,71,Cricket
Comparing the middle orders of the top 5 (ICC rankings) ODI teams over the last 2 years,https://www.reddit.com/r/Cricket/comments/7xgwnn/comparing_the_middle_orders_of_the_top_5_icc/,39,Cricket
Kagiso Rabada has been fined 15% of his match fee and handed one demerit point for breaching the ICC Code of Conduct during fifth,https://twitter.com/cricbuzz/status/963710629826633728,30,Cricket
Last woman standing,https://www.reddit.com/r/ANormalDayInRussia/comments/7xgdma/last_woman_standing/,5737,ANormalDayInRussia
Luke Shaw on Instagram - Happy Valentine’s Day Everyone 😍 @d_degeaofficial,https://instagram.com/p/BfLGcpyFAW6/,165,reddevils
Instagram shitposting edit.,https://www.reddit.com/r/PewdiepieSubmissions/comments/7xgrl3/instagram_shitposting_edit/,181,PewdiepieSubmissions
"Me at 6 getting a ps1 for Christmas, a pivotal moment in my life- if you couldn't tell",https://imgur.com/lHvquBg,11.6k,gaming
Punjab national bank reports $1.8 billion fraud at a Mumbai branch,https://www.ndtv.com/india-news/punjab-national-bank-reports-1-8-billion-fraud-at-a-mumbai-branch-1812491,60,india
Kitty and her horse friend 🐱🐴,https://gfycat.com/SmoggyPartialBlackfish,12.1k,AnimalsBeingBros
[Rant] Data privacy is joke and India is a country which keeps on giving.,https://www.reddit.com/r/india/comments/7xftmu/rant_data_privacy_is_joke_and_india_is_a_country/,46,india
A prank in a Scottish pub,https://i.imgur.com/FdZ9yPh.gifv,21.7k,MadeMeSmile
Secret of birth.,https://www.reddit.com/r/funny/comments/7xexo0/secret_of_birth/,6555,funny
SpaceX to launch its satellite internet prototypes this weekend,https://www.engadget.com/2018/02/13/spacex-launch-satellite-internet-starlink/,8142,technology
The pro's of not having a famous alter ego,https://i.imgur.com/DjxQTfD.jpg,6110,funny
Happy MahaShivRaatri,https://i.redd.it/q20rbbcng3g01.jpg,59,india
What are some foods you thought you hated but turned out your parents sucked at cooking them?,https://www.reddit.com/r/AskReddit/comments/7xfn4g/what_are_some_foods_you_thought_you_hated_but/,7971,AskReddit
[Image] Don't know why. But this is always a go to for when I need a quick pick me up. Innocent and so true.,https://www.reddit.com/r/GetMotivated/comments/7xfg49/image_dont_know_why_but_this_is_always_a_go_to/,2660,GetMotivated
Pills,https://gfycat.com/RespectfulZigzagAoudad,7324,woahdude
"Don’t use Huawei phones, say heads of FBI, CIA, and NSA",https://www.theverge.com/2018/2/14/17011246/huawei-phones-safe-us-intelligence-chief-fears,158,Android
Damn freshies,https://i.redd.it/ivmbr1ee53g01.jpg,22.5k,teenagers
Raj karega Khalsa!,http://indiachan.com/static/images/1518354366594804.jpg,20,bakchodi
India tourism grows 8.4%,http://www.ttrweekly.com/site/2018/02/india-tourism-grows-8-4/,67,india
Mysterious clear liquid,https://www.reddit.com/r/youseeingthisshit/comments/7xfrhe/mysterious_clear_liquid/,6331,youseeingthisshit
"Manged to log into my 4th grade ifunny account, I will post every unfunny meme everyday until I run out",https://www.reddit.com/r/ComedyCemetery/comments/7xfquo/manged_to_log_into_my_4th_grade_ifunny_account_i/,4703,ComedyCemetery
Puppy Barkours down the stairs [x-post from r/aww],https://i.imgur.com/cLqhrPt.gifv,5444,barkour
Ebay gamer sharing the love,https://i.imgur.com/dziTC93.jpg,2903,gaming
False news promoted by mainstream Indian media has become a major embarrassment for India,https://twitter.com/trtworld/status/963457766227566592,38,india
A R Rahman on Amul Surabhi,https://www.youtube.com/watch?v=rqeEegDzDDM,46,india
N.Korea cheerleaders' reaction to Kim Jong Un impersonator.,https://www.reddit.com/r/pics/comments/7xh6np/nkorea_cheerleaders_reaction_to_kim_jong_un/,1800,pics
"“Thanks man, I’ll give your headphones back in a few days!”",https://www.reddit.com/r/mildlyinfuriating/comments/7xegg6/thanks_man_ill_give_your_headphones_back_in_a_few/,12.2k,mildlyinfuriating
This remarkable photo shows a single atom trapped by electric fields. Shot by David Nadlinger (University of Oxford). This picture was taken through a window of the ultra-high vacuum chamber that houses the trap.,https://www.reddit.com/r/Physics/comments/7xhcu1/this_remarkable_photo_shows_a_single_atom_trapped/,304,Physics
[Image] Some earthBound motivation!,https://www.reddit.com/r/GetMotivated/comments/7xdepe/image_some_earthbound_motivation/,18.6k,GetMotivated
To the guy who gave me $1,https://www.reddit.com/r/TwoXChromosomes/comments/7xgqgk/to_the_guy_who_gave_me_1/,680,TwoXChromosomes
"Xiaomi Redmi Note 5 Pro with Snapdragon 636 and dual cameras launched, prices start at Rs 13,999",https://hub.91mobiles.com/xiaomi-redmi-note-5-pro-india-launch-price-specifications-features/?utm_source=twitter&utm_medium=post,110,Android
Punjab minister flips coin to decide on posting of lecturers,https://m.timesofindia.com/india/punjab-minister-flips-coin-to-decide-on-posting-of-lecturers/articleshow/62903942.cms,40,india
"LPT: When someone is excited about something that isn't a good idea, don't burst their bubble right away. They won't be open to hearing the negative. Wait til they're in a more logical state and then ask the questions that will make them realize why it's not a good idea.",https://www.reddit.com/r/LifeProTips/comments/7xe62l/lpt_when_someone_is_excited_about_something_that/,32.9k,LifeProTips
The dream of many Indian news watchers..,https://i.imgur.com/Le5BfOU.jpg,39,india
Pit bulls are adorable too,https://www.reddit.com/r/aww/comments/7xf7za/pit_bulls_are_adorable_too/,41.6k,aww
Help!! Fraudulent transactions happening on Debit card,https://www.reddit.com/r/india/comments/7xgspd/help_fraudulent_transactions_happening_on_debit/,16,india
Sliding into those DMs on Valentines Day be like:,https://www.reddit.com/r/funny/comments/7xg563/sliding_into_those_dms_on_valentines_day_be_like/,1236,funny
Wait,https://www.reddit.com/r/Badfaketexts/comments/7xezlk/wait/,2537,Badfaketexts
"Prince Henrik of Denmark, has passed away, at the age of 83. Rest In Peace.",https://www.reddit.com/r/europe/comments/7xfgv0/prince_henrik_of_denmark_has_passed_away_at_the/,10.6k,europe
Amethi youth writes to Smriti Irani: Help me start 'pakoda' business - Times of India,https://timesofindia.indiatimes.com/city/lucknow/amethi-youth-writes-to-smriti-irani-help-me-start-pakoda-business/articleshow/62910580.cms,30,india
Parents questioning...,https://www.reddit.com/r/calvinandhobbes/comments/7xd6gl/parents_questioning/,10.4k,calvinandhobbes
"Healer, Kevin Champeny, 30,000+ hand cast urethane pain killers and prescription drugs (47”x36.5”x1”), 2017",https://gfycat.com/RespectfulZigzagAoudad,30.8k,Art
Betty from The Flintstones cosplay,https://www.reddit.com/r/pics/comments/7xervy/betty_from_the_flintstones_cosplay/,19.8k,pics
N.Korea cheerleaders' reaction to Kim Jong Un impersonator.,https://www.reddit.com/r/pics/comments/7xh6np/nkorea_cheerleaders_reaction_to_kim_jong_un/,1807,pics
Drunk monkey created ruckus in a bar. He was a regular at the bar !,http://timesofindia.indiatimes.com/city/bengaluru/drunk-monkey-have-fun-in-bar/articleshow/62914869.cms?utm_medium=referral&utm_campaign=iOSapp,16,india
Tax-free billions: Australia's largest companies haven't paid corporate tax in 10 years,http://www.abc.net.au/news/2018-02-14/corporate-tax-australian-companies-havent-paid-in-10-years/9443840,29.0k,worldnews
For those feeling sad on this fine day :),https://www.reddit.com/r/funny/comments/7xfuzd/for_those_feeling_sad_on_this_fine_day/,2448,funny
hApPy vAlEnTiNeS,https://www.reddit.com/r/PewdiepieSubmissions/comments/7xggbk/happy_valentines/,294,PewdiepieSubmissions
This falcon stopped by to take a picture.,https://www.reddit.com/r/confusing_perspective/comments/7xehu3/this_falcon_stopped_by_to_take_a_picture/,4108,confusing_perspective
The stage is set...,https://i.redd.it/80rfzqkoy5g01.jpg,93,chelseafc
BlAcK pANTher DEMolISHinG CHeetAH,https://www.reddit.com/r/PeopleFuckingDying/comments/7xg7fm/black_panther_demolishing_cheetah/,2817,PeopleFuckingDying
Happy St. Valentine's Day!,https://www.reddit.com/r/funny/comments/7xft80/happy_st_valentines_day/,1426,funny
"Apparently drunk me made a subreddit 6 months ago called ""Gatorade Bath"". Sober me literally just found out.",https://www.reddit.com/r/funny/comments/7xeluo/apparently_drunk_me_made_a_subreddit_6_months_ago/,10.6k,funny
Hardik Pandya taking it literally that he can do anything. You will not believe what he's done now !!,https://www.instagram.com/p/BfLA3UqhCGY/?hl=en&taken-by=hardikpandya93,13,Cricket
[Update] Anyone getting unsolicited and shady SMS giving stock tips?,https://www.reddit.com/r/india/comments/7xg29o/update_anyone_getting_unsolicited_and_shady_sms/,26,india
anime_irl,https://i.imgur.com/3mR6Vja.gifv,9127,anime_irl
I'm glad Google is taking cow privacy seriously.,https://i.imgur.com/RP5KpD3.jpg,2931,funny
How thoughtful,https://vgy.me/QU7oOK.png,1002,memes
"Muslim woman deletes Facebook account after rape threats by Islamists, Communist says not as bad as Khap threatening women",http://www.opindia.com/2018/02/muslim-woman-deletes-facebook-account-after-rape-threats-by-islamists-communist-says-not-as-bad-as-khap-threatening-women/amp/?__twitter_impression=true&,19,IndiaSpeaks
Looks like he's still pretty upset about the failure of his theme park..,https://i.imgur.com/185Aamh.jpg,3776,funny
Morata with the banter on Instagram!,https://i.redd.it/cuveerklq5g01.jpg,147,chelseafc
"Pastor was ‘counseling’ the young, naked man tied up in his car, he says",http://www.centredaily.com/news/nation-world/national/article199967274.html,36.2k,nottheonion
"Why do we have to ""register"" for DND with ISP/TRAI to block the spam callers, shouldn't it be the default?",https://www.reddit.com/r/india/comments/7xfyzb/why_do_we_have_to_register_for_dnd_with_isptrai/,25,india
Varun Grover Elaborating Saala Yeh Dukh Kaahe Khatam Nahi Hota | Masaan scene,https://m.youtube.com/watch?v=N5eqULg2Yts&feature=youtu.be,33,india
I helped!,https://gfycat.com/ajarmeagergrayling,3095,motorcycles
Ambani says,https://www.reddit.com/r/bakchodi/comments/7xgqvd/ambani_says/,19,bakchodi
That face though😂😂 but still carry your wallet pewds.,https://www.reddit.com/r/PewdiepieSubmissions/comments/7xh3e0/that_face_though_but_still_carry_your_wallet_pewds/,36,PewdiepieSubmissions
[NP] Punjab National Bank Reports $1.8 Billion Fraud At A Mumbai Branch,https://www.ndtv.com/india-news/punjab-national-bank-reports-1-8-billion-fraud-at-a-mumbai-branch-1812491?pfrom=home-topscroll,19,india
Shhh,https://www.reddit.com/r/PewdiepieSubmissions/comments/7xhbpx/shhh/,127,PewdiepieSubmissions
Xiaomi Redmi Note 5 review: The best just got better,https://www.androidcentral.com/xiaomi-redmi-note-5-review,39,Android
Manchester United Season Reviews 2012-2017,https://drive.google.com/drive/folders/1usOrnXja3mgsk1T_b-agl8qu2R9iGVSn?usp=sharing,39,reddevils
#2 on CMC for Biggest gainers.,https://www.reddit.com/r/INDICOIN/comments/7xgobd/2_on_cmc_for_biggest_gainers/,13,INDICOIN
"There is a reason why stand-ups, editors, journos, actors are not outraging. Guess what",https://www.reddit.com/r/bakchodi/comments/7xfqhc/there_is_a_reason_why_standups_editors_journos/,37,bakchodi
"So,what'd you choose ?",https://www.reddit.com/r/marvelstudios/comments/7xf4ga/sowhatd_you_choose/,1058,marvelstudios
Honor India is running negative Twitter campaign against Xiaomi's Redmi Note 5 launch,https://onphones.com/dear-honor-india-stop-cheap-marketing-tactics/1979/amp/,59,Xiaomi
Art degree shart degree,https://www.reddit.com/r/funny/comments/7xfaxr/art_degree_shart_degree/,1938,funny
A little fan art,https://www.reddit.com/r/mkbhd/comments/7xfadm/a_little_fan_art/,180,mkbhd
This valentine ..,https://i.redd.it/yj99byfcy3g01.jpg,693,ProgrammerHumor
"Andile ""We have now got measure of Indian spinners"" Phehlukwayo smashes Kuldeep Yadav out of the park for a 150m SIX!",https://streamable.com/4wx7k,401,Cricket
On the topic of a Youtubers house being broken into,https://www.reddit.com/r/iamverybadass/comments/7xg5qw/on_the_topic_of_a_youtubers_house_being_broken/,2153,iamverybadass
My buddy installed a camera after constantly being ding dong ditched. Today he found the culprit.,https://www.reddit.com/r/funny/comments/7xebuv/my_buddy_installed_a_camera_after_constantly/,11.5k,funny
You've made it my boy,https://www.reddit.com/r/PewdiepieSubmissions/comments/7xgfpr/youve_made_it_my_boy/,194,PewdiepieSubmissions
Complaint filed against Priya Prakash Varrier's 'wink' song for 'hurting Muslim sentiments',https://www.indiatoday.in/movies/regional-cinema/story/priya-prakash-varrier-complaint-filed-oru-adaar-love-malaraya-poovi-1169176-2018-02-14,19,india
YSK: Fuel prices are expected to fall further by Rs 2-3 in the coming fortnight [NP],https://www.reddit.com/r/india/comments/7xfzlh/ysk_fuel_prices_are_expected_to_fall_further_by/,21,india
Some day...,https://www.reddit.com/r/LateStageCapitalism/comments/7xeng4/some_day/,9646,LateStageCapitalism
How To Pronounce Indian Car Names,https://youtu.be/sdnhUYbq4V0,•,india
r/PewdiepieSubmissions,https://www.reddit.com/r/PewdiepieSubmissions/comments/7xfu2b/rpewdiepiesubmissions/,166,PewdiepieSubmissions
Careem on Valentine's Day,https://imgur.com/kvLnDIN,34,pakistan
2 years ago Divock showed us the true spirit of Valentine's,https://twitter.com/Gerrard8FanPage/status/698891511228981252,119,LiverpoolFC
What are you sick of trying to explain to people? [x/post Askreddit],https://www.reddit.com/r/india/comments/7xgwn3/what_are_you_sick_of_trying_to_explain_to_people/,11,india
Firefighters in Arizona putting out a Mexican fire,http://i.imgur.com/CbkXweL.jpg,105k,pics
"After 6 years dating (the past 3 long distance), SHE SAID YES",https://www.reddit.com/r/happy/comments/7xfsfn/after_6_years_dating_the_past_3_long_distance_she/,1484,happy
I'm not sure guys I think Sonic's an elephant,https://www.reddit.com/r/PewdiepieSubmissions/comments/7xfemu/im_not_sure_guys_i_think_sonics_an_elephant/,401,PewdiepieSubmissions
"[P] No more films for me, my plunge into politics is final, says Kamal | The News Minute",https://www.thenewsminute.com/article/no-more-films-me-my-plunge-politics-final-says-kamal-76425,37,india
Star Trek predicted the notch and rounded corners too!,https://www.reddit.com/r/iphone/comments/7xefpg/star_trek_predicted_the_notch_and_rounded_corners/,2302,iphone
"Echidna, along with platypus, is a member of monotremes, egg-laying mammals that do not have nipples",https://i.imgur.com/7Ijh2Wq.gifv,14.5k,Awwducational
I Made A Black Panther Poster From Photos of the Characters,https://i.imgur.com/JYQOXz6.png,636,marvelstudios
Fluoroscopy of a cat,https://i.imgur.com/xlQJiBH.gifv,2308,Damnthatsinteresting
Ops I did it again,https://www.reddit.com/r/PewdiepieSubmissions/comments/7xh2nb/ops_i_did_it_again/,69,PewdiepieSubmissions
"Our condescending international student ""friend"" decided to leave the group chat because we were sending too many notifications, so he wrote a program in swift in the text message.",https://www.reddit.com/r/iamverysmart/comments/7xf0kk/our_condescending_international_student_friend/,2372,iamverysmart
Finally,https://www.reddit.com/r/WhitePeopleTwitter/comments/7xgg85/finally/,1618,WhitePeopleTwitter
Let's take a picture of my best friend,https://i.imgur.com/HKqarYt.jpg,1728,aww
This part never fails to get me,https://www.reddit.com/r/DunderMifflin/comments/7xezs7/this_part_never_fails_to_get_me/,5751,DunderMifflin
The Poignant Contrast Of India's Pillars (credit to u/dawnphoenix),https://i.imgur.com/AnJoLOd.gifv,247,Cricket
